names,places,addresses,times,teles,titles,descs
银川动物园,灵武,北京东路152号,明日08:00开放（18:00停止入园）,0951-5043629,介绍->开放时间,"银川市动物园位于位于兴庆区中山公园内，银川市区内风景游览区之一。可以从北京东路的北门进，也可以从凤凰北街的西门进。正门（南门）位于湖滨西街，另有北门位于北京东路，西门位于凤凰北街。据志乘所载，这里原为西夏国元吴宫遗址，当时的元吴宫“逶迤数里，亭榭台池，并极其盛”，为西夏国都兴庆府第一大建筑，后毁于战火。明嘉靖年间，此为镇属兵马营房，俗称‘西马营”。1929年，冯玉祥属下门致中在此兴建公园，正式命名为“中山公园”。1949年以后，经过30多年的精心规划和修建，公园面积扩大到780亩，内有“银湖”，增添了“烈士纪念亭”“朔方亭”、“游船码头”、“玉带桥”、“少年科技站”、“儿童活动场”及动物园等20多处景观及游乐场所。园中浓荫蔽日，亭台错落，每天都吸引着大量游人前来赏玩。->全年 08:00-18:00,（18:00停止入园）；具体营业状态以当天开放情况为准"
玉皇阁,灵武,银川市兴庆区玉皇阁北街2号,,,介绍->开放时间,"玉皇阁始建于明代洪武年间，迄今已有600多年的历史，是一座重楼叠阁、飞檐相啄、结构紧凑、玲珑别致的传统木结构大屋顶建筑。因内铸玉帝像，故称之为玉皇阁。
玉皇阁主阁为重檐二层阁楼，阁高约有22.1米，台基呈长方形，犹如大鹏展翅，凌空欲飞，气势宏伟。玉皇阁同鼓楼遥相辉映，别有情韵。登临阁顶，可凭栏西眺巍巍贺兰山，东望滚滚黄河->全年 全天开放"
董府,灵武,宁夏回族自治区吴忠市金积镇露天洼子村,明日09:00开放,,介绍->开放时间,"董府位于宁夏回族自治区吴忠市金积镇露天洼子村，是清末著名将领甘肃提督董福祥的府邸，因董福祥曾官加“太子少保”衔，又称“宫保府”。董府始建于
1902
年，
1905
年竣工，初建时占地一百余亩，由护府河、府廓、外府、内府四部分组成。历经百年，现仅存内府墙和府内四合院建筑群，占地面积
14391
平方米，建筑面积
8721.9
平方米。
董福祥（
1840-1908
年），字星五，清代甘肃固原（今属宁夏）人，官至尚书提督（上将）。
1876
年（光绪二年），董福祥随左宗棠进兵新疆，参与平定阿古柏战役。收复新疆后，先后任阿克苏镇总兵、喀什噶尔提督，驻守新疆
16
年。
1894
年，因中日甲午战争爆发调驻京畿。
1898
年，所部甘军编入荣禄所辖武卫军，成为北洋三军之一。
1900
年，八国联军侵入北京，率部竭力抵抗，随后因列强施压被解职。
1902
年，董福祥选址金积堡建董府。
1908
年
2
月，病故于宁夏金积堡，葬于固原王朝山。
董府所在地原是一片湖地，以黄土夯垫而起，所用工匠及材料选自全国。木料，来自甘南；石料，来自陕西；木匠多来自四川，铁匠多来自包头，石匠来自陕西；砖瓦石灰均就地烧造。历时三年多，用工三百多万人次，耗粮五百万斤，耗费白银三十万两。->2023年1月1日-2023年12月31日 09:00-17:00,"
水洞沟村,灵武,银川市灵武市临河镇水洞沟旅游区内,明日08:00开放,,介绍->开放时间,"水洞沟村是一个古老的半地穴式的聚集村落遗址。在古老的水洞沟村里，保留着北方先民们创造的窑洞式和半地穴式的居室。水洞沟村继承了这种古老居住方式，在黄土坡上先挖出一定深度的地穴，然后在地穴四周边缘上，用土坯垒起矮墙，使之高出地面，再以桁条，木椽搭顶，覆以柴草，在柴草上糊以泥巴，防止漏水。->全年 08:00-18:00,"
天山海世界黄河明珠,灵武,银川市兴庆区滨河黄河大桥与203省道交叉口北侧,明日10:00开放（16:00停止入园）,18695122330,介绍->开放时间->必看贴士,"山海世界黄河明珠设计灵感源自迪拜亚特兰蒂斯水生活理念——奇迹、海洋、探索，把大海搬到了室内，让游客尽享水世界波澜风光。场馆全年保持在30度恒温，28度水温，既避免了季节和天气对戏水项目的影响，又满足了爱美人士玩水不晒黑的需求，实现游客一年四季可戏水、日场夜场皆可玩的游玩梦想。->全年 10:00-18:00,（16:00停止入园）；中秋节 10:00-18:00开放（16:00停止入园）；17:30清场（每周一闭园，节假日除外）->银川天山海世界景区直通车（自费项目）
1、乘车线路如下：
森林公园北门发车——北京路康槐园公交站——中山公园北门——北京路北苑小区公交站——北京路清和园公交站——新月广场停车场——北京路在水一方公交站——友爱车场——天山海世界
2、乘车时间如下：
 第一班：
09:00森林公园北门
09:40新月广场停车场
返回时间：下午16:00
 第二班：
11:00森林公园北门
11:40新月广场停车场
返回时间：下午17:40
 法定节假日及周六周天加车次：
16:00森林公园北门
16:40新月广场停车场
返回时间：21:00
3、车费15元/人（单程）
4、需提前预约电话：18695386061->银川天山海世界景区直通车（自费项目）
1、乘车线路如下：
森林公园北门发车——北京路康槐园公交站——中山公园北门——北京路北苑小区公交站——北京路清和园公交站——新月广场停车场——北京路在水一方公交站——友爱车场——天山海世界
2、乘车时间如下：
 第一班：
09:00森林公园北门
09:40新月广场停车场
返回时间：下午16:00
 第二班：
11:00森林公园北门
11:40新月广场停车场
返回时间：下午17:40
 法定节假日及周六周天加车次：
16:00森林公园北门
16:40新月广场停车场
返回时间：21:00
3、车费15元/人（单程）
4、需提前预约电话：18695386061"
灵武西湖公园,灵武,银川市灵武市嘉源路,,,介绍->开放时间,西湖位于灵武市城镇西门，过去是一片鱼湖，湖中鱼儿游荡，飞鸟成群，宛如江南的景色，后经开发、治理和保护，被改造成西湖公园的一部分，整体建筑防唐朝风格，而且很难能可贵的是周边建筑和公园基本一致，现已成为人们休闲娱乐的好去处。->全年 全天开放
西夏陵遗址区,灵武,银川市西夏区西夏陵景区内,11月1日-次年3月31日8:00-17:30,0951-5668960,介绍->开放时间,西夏陵是西夏王朝（1038—1227年）的帝王陵寝，坐落在贺兰山东麓。陵区规模宏大，蔚为壮观，在方圆53平方公里的范围内，依山势布列着9座帝陵和271座陪葬墓；是西夏历史留存至今规模大、等级高、保存完整的建筑遗存，见证了西夏王朝的存在和君主世袭，并为这一业已消失的古代文明提供特殊的见证。西夏陵国家考古遗址公园以110国道分界为两个区域：西夏陵遗址区与文化旅游综合服务区。遗址区对外开放一、二、三、五、六号帝王陵及陪葬墓群。->4月1日-10月31日8:00-18:00；11月1日-次年3月31日8:00-17:30
南门楼,灵武,银川市兴庆区南华东路(中山南街口),,,介绍->开放时间,南门楼又称南薰楼，南门楼通高二十多米，台基正中壁有一个南北方向的拱形门洞，台基北面门洞两侧有台阶，整座建筑结构严谨、气势恢宏，非常漂亮。->全年 全天开放
古城湾旅游区,灵武,吴忠市利通区古城镇世纪大道永福垂钓中心附近,,,介绍->开放时间,古城湾是黄河九十九道湾中美丽的一处。她从市区西侧缓缓流过，两岸地势平坦，稻香谷美，呈现出一派迷人的江南景色。作为一处集休闲、娱乐、观光、度假于一体的综合性大型城市公园，旅游区内绿树成林、芳草成茵、喷泉吐柱，亭台隐于楼阁林立之间，鸟雀憩于花草飘香之中，若乘坐汽艇穿梭于碧波荡漾的人工湖上，或乘羊皮筏子飘行于悠悠黄河之上，心中便会荡起一个个涟漪。黄昏时刻，来到河畔，闲庭信步，透过轻飘舞动的芦苇花梢，夕阳尽染大地，“长河落日圆”的景象跃入眼帘，令人回味无穷。->具体营业状态以当天开放情况为准
宁夏幻太奇海洋公园,灵武,银川市金凤区悦海新天地购物中心东区1-3层,明日10:00开放（17:30停止售票）,"0951-6035553,0951-6035554",介绍->开放时间,"宁夏BHG幻太奇海洋公园位于银川市金凤区康平路北京华联悦海新天地购物中心，占地总面积6600余平方米，总投资8000万元人民币。是宁夏集观赏性、互动性、参与性、趣味性、知识性、娱乐性为一体的大型室内海洋主题公园。
宁夏BHG幻太奇海洋公园内设锦福东方、梦幻潘多拉、彩羽之林、亚特兰蒂斯之城、星语心愿、深海迷城、水星舞语、水母星宫、马达加斯加探险岛、星宫宝藏等十大主题展区。馆内总水体量超3000吨，饲养和展示的海洋鱼类及生物达1000多种、20000多尾。
神秘的幻太奇海洋育有包括大鲨鱼、海龟及其他各种珍稀鱼类，在270°海底观景隧道中美丽婀娜的人鱼穿梭其中，游客可以透过蔚蓝的海水感受到亚特兰蒂斯的历史和文明；这里还有憨态可掬的海狮表演，幽默俏皮的鹦鹉表演；更有可爱的白袋鼠、羊驼、环尾狐猴等萌宠精灵期待与您亲密接触，让我们一同前往那片神秘梦幻的海底世界，一睹风采吧！
惊喜体验，尽在浪漫幻太奇！->全年 10:00-18:00,（17:30停止售票）"
红山湖,灵武,银川市灵武市宁夏回族自治区银川市灵武市灵河镇水洞沟内,,,介绍,红山湖是蓄积边沟之水而成的，湖面宽广，水质清澈，水面上时有鸳鸯、野鸭游弋。是一处休闲放松的理想之地。
承天寺塔,灵武,银川市兴庆区利民街121号,,,介绍->开放时间,"承天寺塔，位于银川兴庆区（老城区）的承天寺内，当地人俗称“西塔”。承天寺始建于西夏垂圣元年（公元1050年），西夏开国皇帝李元昊死后，其子年幼登位，皇太后为保其子“圣寿无疆”，和西夏江山“永固”，建造了承天寺和承天寺塔。承天寺塔是宁夏惟一有文献记载始建年代的古塔，原塔在地震中震毁，如今所见的是清代重建的古建筑。
承天寺的寺门是朝东开启的，与中原寺庙大多“坐北朝南”有所不同，这可能和西夏民族崇拜东方或太阳有关。进入大门后，东西方向的中轴线上坐落着五佛殿、佛塔、韦驮殿、卧佛殿等主要建筑，各个建筑之间，用小门和围墙连接，行程了四合院式的院中院，小门上有很古朴砖雕的垂花。


现今在承天寺内还能登上高达六十多米的承天寺塔。塔门也是面向东开，当你进入方形的塔室，会看到这里有木楼梯盘旋而上，在三、五、七、九层，有南北方向券门式的明窗，在四、六、八、十层有东、西方向多门式的明窗，而在十一层有四明四暗的圆窗，在这里你可以通过明窗眺望银川市的老城区。
承天寺塔的每层之间的塔檐上下各挑出三层棱牙砖，各层檐角石榴状的铁柄上都挂着铁铃，微风吹过时，叮叮当当的作响。在承天塔的周围，有六棵400多年的老槐树，与照壁上精致的雕刻相映，充满了古朴的气息。寺内曾经还设有宁夏博物馆，现在已经迁走，如果你的时间比较充裕，在寺内散散步，听听古塔上的铁铃声，怀古之情油然而生。->全年（冬令时） 09:00-17:00,（17:00停止入园）；全年（夏令时） 09:00-17:30,（17:30停止入园）；全年 周一"
银川美术馆,灵武,泰康街8号,明日09:00开放（17:00停止入园）,0951-5087986,介绍->开放时间,"银川美术馆建筑宏伟壮观，古朴典雅，内部设有展览部、研究部、收藏部等，是集征集收藏、陈列展览、研究等为一体的美术馆。->全年 09:00-17:00,（17:00停止入园）"
银川南关清真寺,灵武,银川市兴庆区玉皇阁南街288号,明日08:00开放（17:00停止入园）,,介绍->开放时间,"原寺地址在银川南关外“拱北”亭，规模较小。1916年将寺址迁入南关内，建成一座具有古典风格的大寺。60年代寺院在动乱中被毁殆尽。1981年募资在今址重建。->全年 8:00-17:00,（17:00停止入园）；具体营业状态以当天开放情况为准"
沙温泉度假区,灵武,银川市兴庆区孔司路南150米,,0951-6126666,介绍->开放时间->优待政策->服务设施,"沙温泉度假区是以沙文化为主题的温泉度假村，位于银川市兴庆区掌政镇，紧邻北京东路，距市区不足十公里。室内温泉以西北大漠风情与亚热带雨林风光巧妙融合，呈现出一种全新的视觉效果。温泉区占地面积五万平方米，多种形式的泡池达七十多个，分别为游泳池、儿童戏水池、亲亲鱼疗池、沙浴池、海盐池、决明子池等。->全年 全天开放->儿童：1.2米（含1.2）以下儿童免费，免费；1.2米（不含）-1.4米（含）儿童，半价->停车场：【沙温泉景区停车场】参考价格：免费；地址：沙温泉景区东侧；库位：500
WIFI：账号：沙温泉；密码：88888888.0；范围：全域
手机充电：
卫生间：
吸烟区：地理位置：见园内指引牌
残障通道：
餐饮：
便利店：
泡汤：
娱乐设施："
纳家户大寺,灵武,银川市永宁县纳新路纳家户回乡文化广场西北侧,,,介绍->开放时间,"纳家户大寺位于永宁县城西，是一座传统的中古式建筑寺院。建筑整体呈长方形，翠瓦飞檐、古色古香，以门楼、礼拜大殿、厢房、沐浴堂组成院落，形成典型的中国古代四合院建造布局。
据记载，纳家户大寺为元初贵族塞典赤·瞻思丁子纳速拉丁之后裔纳性子孙从陕西移居宁夏后于明嘉靖三年(公元1524年)所建，距今已有四百八十年历史。融阿拉伯风格和汉唐建筑艺术为一体。寺院前“凸”形照碑，青砖砌起，高10米，宽22米，上雕《古兰经文》图案与邦克楼对峙。
寺院门楼为过洞式，上面壁部是一组仿古结构的挑檐，横向的栏额、斗拱，纵向的荷花柱和精美的砖雕，增加了壁面的光泽。上部正中为三层歇山顶邦克楼，楼两侧陪立着阿拉伯式的二层四角圆尖顶的望月楼。整个布局严谨、规整，显示了大寺雄壮气势。->全年 周一-周三 11:00-22:00, 周四 11:00-01:00, 周五 11:00-03:00, 周六 17:00-02:00, 周日"
宁夏科技馆,灵武,银川市金凤区人民广场西路,,0951-5085123,介绍->开放时间->必看贴士,"宁夏科技馆是宁夏规模较大的科普教育场所，也是宁夏青少年科技活动场馆。宁夏科技馆内，通过各种现代化的设备，运用了文字图片、多媒体、标本模型等形式，让大家近距离接触到各类科学知识、培养对科学的热情和兴趣，特别适合青少年或者家长带着孩子一同前来游玩。
宁夏科技馆分为三层高的展馆主体大楼和穹幕影院两部分。在展馆大楼一层内，能够看到神州七号飞船的模型。一层的“月夜星辰”小屋内，有一个美丽的模拟星空，只要你按下星座图上的按钮，就会在星空图上显示你对应的星座，小游客们都非常喜欢这个互动游览项目。
在二楼展厅，有众多的栩栩如生的动物标本和各类科技展品模型，如：恐龙化石、磁铁树、三维立体画等，还能在这里看到蛇形机器人等各种机器人。在三楼的儿童乐园展区游客可以动手操作各种互动展品，如：电磁秋千、树公公拍脸、音乐篱笆等等。
在主体大楼旁的穹幕影院内，可以观看到动感的4D和5D电影，5D电影一般只在节假日才有播放。->全年 周三-周日 09:00-17:00, 周一-周二；具体营业状态以当天开放情况为准->宁夏科技馆4D影院开放时间为周三至周日及法定节假日，穹幕影院开放时间为周六周日及法定节假日，观众可在影片开始前15分钟在一楼服务总台排队领票观影（需提前出示展厅预约二维码）。具体开放时间及参观以实际情况为准。->宁夏科技馆4D影院开放时间为周三至周日及法定节假日，穹幕影院开放时间为周六周日及法定节假日，观众可在影片开始前15分钟在一楼服务总台排队领票观影（需提前出示展厅预约二维码）。具体开放时间及参观以实际情况为准。"
白芨滩自然保护区,灵武,银川市灵武市307国道旁,,0951-4030015,介绍->开放时间,"白芨滩自然保护区位于宁夏回族自治区灵武市境内，毛乌苏沙地边缘。保护区总面积74843公顷，主要保护对象为荒漠生态系统及典型的荒漠野生动植物资源。
保护区地处鄂尔多斯台地的西南隅，南接黄土生陵区，地貌属于丘陵地带，分为低山丘陵、缓坡丘陵和沙漠低山丘陵，海拔高度1150-1650米之间。区内荒漠植被保存良好，尤其是中部核心区内分布的以柠条为主的1.7万公顷天然荒漠灌木群落。
区内已知高等植物有53科170属306种，野生动物23目47科115种，其中列为国家重点保护的野生动物有黑鹳、荒漠猫、兔狲、鹅喉羚、鸢等22种；列入濒危野生动物国际贸易公约保护的有绿翅鸭、白琵鹭、猎隼等23种。->暂时停业，具体营业（开放）时间详见景区公示。全天开放"
灵武高庙,灵武,银川市灵武市复兴街,,,介绍->开放时间,"灵武高庙位于银川市灵武市复兴街，整体庙宇坐北朝南，聚庙宇群为一整体，主体建筑始终分布在一条中轴线上，体现出中国古代建筑艺术的结晶。
灵武高庙又称上帝庙、玉皇庙，原名为玄武观，始建于隋开皇二十年，主要建筑包括南天门、无量殿、王母殿、观音阁等11座庙宇。->全年 全天开放"
怀远观光夜市,灵武,文萃北街128号,,,介绍,夜市小吃一条街，是怀远比较大的夜市商业街，外围多是小吃，内围多是音乐酒吧或者烤吧。
银川花博会,灵武,银川市览山公园北侧,9:30-22:00开放,,介绍->开放时间->优待政策,"5800多亩花海，60多个风格各异的场馆展区，全国30多个省市、自治区携珍贵花卉参展。更有观光云轨进驻花博会，游客可乘云轨畅游全园。花博园内更有异国风情展区埃及馆供人游览。湖光山色美轮美奂，各色花卉争奇斗艳，浪漫花海沁人心脾，科技展馆令人流连忘返。


中国花卉博览会，属于经国家批准继续举办的展会活动，每四年一届，是我国规模较大、规格较高、影响较广、内容较为丰富的花事盛会，被誉为中国花卉界的“奥林匹克”。花博会至今已举办八届，从规模、影响上都已大大加深，正在向着国际化的方向发展。


本次花博园的规划结构是“一心、两轴、四岛、多园”。


“一心” 即花博园展馆区，由主题馆、四季馆和综合馆三个室内展馆组成。


“两轴” 即科技文化轴及花博景观轴。


“四岛”由南到北依次为览山岛、回乡岛、花博岛及阅海岛。


“多园”即以展示为主的各个省（区、市）花协室外展园、宁夏各地级市展园、友好城市展园以及各类花卉专类园组成的室外展园系统。->全年 9:30-22:00,->补充说明：1、暂无其他优惠政策。2、以上信息仅供参考，具体情况请以当天景区披露的信息为主。"
景城公园,灵武,银川市滨河新区长河大街与京河大道交汇处向东200米,,,介绍->开放时间->优待政策,银川景城公园以中国地图为构图要素，海南岛、台湾岛、钓鱼岛、黄河、渤海一应俱全，通过湖光山色，小桥流水，奇花异草，廊桥水庭打造独特的人文景观，生态氧吧。->全年 全天开放->补充说明：1、暂无优惠政策，具体请以景区当天披露为准。
银川文化艺术博览中心,灵武,银川市金凤区亲水南大街与六盘山中路交叉口东南侧,,19995102510,介绍->开放时间,"银川文化艺术博览中心分为三层1楼：（中庭）内容提取凤凰、贺兰山、黄河、城中湖、湿地等特色元素为创作灵感，描绘出具有典型代表性的银川符号，一场流光溢彩，如梦似幻的文化科技视觉盛宴就此拉开，打造城市文化客厅网红打卡地。（多维影院）电影级别的主题历史影院，带领观众领略神奇多彩的银川历史。（Vr探险）置身于波澜壮阔的沙丘场景中，坐在摇曳不定的驼背上，或骑上摩托车，或坐在沙滩车里，让您真实地感受到刺激好玩的沉浸体验。（奇幻湿地）以鸣翠湖国家湿地公园为背景，感受七十二连湖生命花园触摸大自然，唤醒湿地幻境。（打卡镇北堡）穿行在复原场景中，以知名电影红高粱、大话西游、龙门客栈等电影场景为背景，供参观者合影留念。（大摆锤）影片将视野放眼整个银川全域甄选具特色的旅游景点，通过VR眼镜与大摆锤设施相结合，通过设施摇摆，配合摇摆镜头切换，营造逼真的游乐体验；2楼：（连接·银川）丝绸之路是一个历史文化符号，“连接”是它的关键词。银川紧紧抓住时代赋予的机遇，主动融入“一带一路”建设，继承和发扬丝绸之路精神，在新时代表达着丝绸之路新的内涵。这座古老的丝路驿站千百年来，与丝绸之路相伴，形成了以和平合作、开放包容、互学互鉴、互利共赢为核心的丝路精神，正焕发着勃勃生机，犹如一颗璀璨的明珠在贺兰山下冉冉升起。（银川时间)新时代、新机遇，面对“一带一路”倡议的时代机遇，银川将蓄力崛起、展翅腾飞，书写美丽、独特、交融的“银川时间”，剧场分别以“绿色、高端、和谐、宜居”四个时空维度为篇章展开，展示银川在“一带一路”倡议下的美时光。（时空三万里）重走丝绸之路，银川与这条东西方文化交流的伟大通道有着深深的历史交融。新时代的今天，银川更与这条纽带密不可分。大型5D时空骑乘剧场《时空三万里》，配合动感的飞行平台，巨幕沉浸式影院，带您从古代长安出发，立足银川，穿越2000年间的丝路文明与现代银川、未来银川之间的联系，探索丝路奥秘；3楼：（文物）银川悠久的历史，沉淀了众多优秀的文化瑰宝，体现着中华民族的生命力和创造力，蕴含着中华民族特有的精神价值，是各民族智慧的结晶，也是全人类文明的瑰宝。我们将透过历史的时光长河，甄别遗留下来的文物宝藏，运用新媒体技术讲述文物背后的故事，重温这方水土中有趣的乡土风情，回望银川这段风云激荡的历史烟云，寻找那段刻在骨子里的文化基因。（花海）一花一世界，一叶一追寻，阅千花，赏千树。沉浸于充满花的世界，漫步于充满花的海洋。每一个看似普通的角落都在演绎着转瞬即逝的美丽瞬间，每一个眨眼倾目之时所领略到的美景都是毫不造作的雲那芳华。（儿童乐园）儿童是我们的未来和希望，这里结合银川本地特色元素打造一个充满魔幻的乐园世界，通过魔法森林、互动地面、动感滑梯、奇幻沙海、疯狂魔法球等奇幻动感的交互体验，来激发儿童好奇心、想象力、创造力，去发现和探索周围的世界。->2023年1月1日-2023年12月31日 周二-周日 10:00-17:00,；2023年5月1日 周一 10:00-17:00,；2023年1月1日-2023年4月30日 周一；2023年5月2日-2023年12月31日 周一"
秦渠公园,灵武,宁夏回族自治区吴忠市利通区文卫南街240号,,,介绍->开放时间,"秦渠乃黄河灌溉支渠之一，系秦朝开凿，流经吴忠，穿越而过，为灌育这块大地发挥了积极作用，有诗为证：“天堑分流引作渠，一方擅利溉膏腴。鱼游浅碧东风细，花涨残红幕雨余。千顷良田凭富足，万家编户获安居…;…;”。1987年吴忠市将秦渠过境段（10公里）改造为秦渠公园。
两岸绿树成荫，郁郁葱葱，花鸟云集，香飘遐迩。宛如一条玉带镶嵌在繁华都市间，为都市带来些许清静和灵气，园内厅台楼榭，曲径通幽，雕梁画栋，错落有致。各种健身器具一应俱全，是市民晨练、游玩、散步小憩的理想场所。->具体营业状态以当天开放情况为准"
欢乐大本营,灵武,银川市永宁县G109国道与观湖路交叉路口向西50米处,明日09:00开放,0951-2055555,介绍->开放时间->优待政策,"欢乐大本营位于银川城南永宁县境内，澳洲草地创建了独一无二的优美环境。目前，营地设有水上乐园、企业拓展、亲子广场、别墅酒店、帐篷烧烤、服务中心、展示中心等专区一应俱全。->全年 ,- 09:00-19:00,；景区已开园->补充说明：1、特殊人群政策： 儿童：1.2米以下免草地维护费。"
