names,places,addresses,times,teles,titles,descs
西岛,五指山,三亚天涯区肖旗港西岛海洋文化旅游区,明日08:00开放（16:30停止售票）,0898-88910888,介绍->开放时间->优待政策->服务设施,"西岛，位于三亚湾的中心位置，是海南的原住民旅游海岛，全岛面积2.8平方公里。岛上风景秀丽，海水清澈见底，是一个集海滨风光、沙滩浴、休闲娱乐、海洋探险于一体的综合性旅游区。
除了水上娱乐，也可以上牛王岛（牛王岭）游玩，牛王岛是一座与西岛几近相连的袖珍小岛，乘电瓶车经环岛西路和一条长长的海上栈道便可抵达。这里拥有最原始的海岛风光，登高远眺，可以欣赏到壮阔的海天一色、鬼斧神工的礁石景观、雄浑的日出日落，向北可一览三亚的城市风光，向南可纵观浩瀚的南中国海。
潜水
西岛享有“潜水圣地”的美誉，有专设的潜水海域，海水清澈湛蓝，海底生物种类繁多，在这里您可以纵身海底，盘恒于珊瑚丛中，感受被珊瑚礁簇拥，与鱼群共舞的乐趣。
海上运动
被三亚湾环抱着的西岛，湛蓝萦绕、水阔潮平，是开展海上运动的天堂；在这里可以尽情体验海上速度与激情的较量，将自己置身在蔚蓝的大海中，感受动感刺激的独特魅力，尽情享受纵身海洋的欢乐时光。帆船、拖曳伞、水上飞龙、摩托艇、香蕉船、飞鱼船、动感快艇等20多项海上运动任你选择~->2023年1月21日 08:00-16:30,（14:30停止售票）；2023年1月22日-2023年12月31日 08:00-18:00,（16:30停止售票）->儿童：1.2米（含）以下，免费
青少年：6周岁（不含）-18周岁（不含）未成年人或身高1.2米（不含）-1.5米（含）儿童，半价
老人：70周岁（含）以上凭海南本地身份证/海南本地县级以上人民政府老龄工作机构核发的老年优待证+身份证/海南社会保障卡，免费；60周岁（含）-69周岁（含）凭海南本地身份证/海南本地县级以上人民政府老龄工作机构核发的老年优待证+身份证/海南社会保障卡，半价
军人：中国人民解放军和武装警察部队的现役军人，革命伤残军人和离退休军人持本人有效证件《军官证》/《警官证》/《军队文职干部证》/《士兵证》/《军人离退休证》/《革命军人伤残证》/《军警院校学员证》，免费
学生：学生凭学生证（小学、初中、大中专学生），半价
残疾人：凭本人有效残疾证，半价
消防救援人员：在职、退休、残疾消防救援人员和消防救援院校学员：有效证件：消防救援队伍干部证、 消防员证、学员证、退休证，免费
补充说明：以上信息仅供参考，具体信息请以景区当天披露为准。->停车场：【西岛停车场】参考价格：收费；地址：西岛海洋文化旅游区景区售票处对面，景区牌子后面；库位：300；小型车8元/辆次（新能源车4元/辆次），中型车10元/辆次（新能源车5元/辆次），大型车15元/辆次（新能源车7.5元/辆次），摩托车1元/辆次，车辆停放时间30分钟（含）以内的不收费用，超出30分钟按一次收费，中途不出场的车辆最高24小时算一次。连续停放超过24 小时按次标准累加计费。合法注册登记的残疾人专用车辆；在指定候客场(点)候客的出租车辆；肢体残疾人驾驶或乘坐的机动车使用公共停车场无障碍停车位的；法律、法规规定其他应当免收车辆停放服务费的免收停车费。
行李寄存：参考价格：10元起；地址：售票大厅
园内交通：参考价格：环岛电瓶车60元/人，牛王岛电瓶车35元/人；地址：电瓶车总站处；环岛电瓶车从景区出发到牛王岛-渔村返回景区，牛王岛电瓶车从景区到牛王岛然后返回景区
卫生间：景区内设有卫生间，在景区入口等地设置有明显标志牌
便利店：西岛内设有多个便利店，可使用支付宝/微信支付。"
海南热带雨林国家公园,五指山,位于海南岛中南部,,0898-65333158,介绍->开放时间,"海南热带雨林国家公园位于海南岛中南部，跨五指山、琼中、白沙、昌江、东方、保亭、陵水、乐东、万宁9个市县，总面积4269平方公里，尖峰岭、霸王岭、鹦哥岭、猴猕岭、吊罗山、五指山、黎母山等均在海南热带雨林国家公园范围内。
海南热带雨林国家公园内拥有中国分布最集中保存最完好连片面积最大的热带雨林，是世界热带雨林的重要组成部分，具有国家代表性和全球性保护意义。
2021年10月12日，海南热带雨林国家公园入选第一批国家公园。->具体营业状态以当天开放情况为准。"
南山文化旅游区,五指山,三亚市崖州区崖城镇南山景区,明日08:00开放（17:00停止入园）,0898-88837888,介绍->开放时间->优待政策->服务设施,"南山文化旅游区是我国有名的宗教与福寿文化景区，在这里既能欣赏山海自然美景，还可拜访众多佛教名胜、参观举世闻名的“南山海上观音”，获得佛教文化带来的心灵荡涤，体味回归自然本真的乐趣。


领略佛教造像艺术的璀璨
南山文化旅游区内遍布气势恢宏的佛教建筑，108米高的南山海上观音庄严壮观，三十三观音堂、南山寺内都不乏形态各异、精雕细琢的佛教圣像。


祈福许愿、拜求平安
我国传扬千古的名句“福如东海，寿比南山”，道出了南山与福寿文化的悠久渊源，是礼佛祈福的佳选之地。


推荐路线：不二法门-南山寺-三十三观音堂-南山海上观音
不二法门是景区的大门景观，寓意了佛教的大智慧，由此进入，便开启了礼佛之旅，离这约几百米处便是景区接驳车的起始站。南山寺、三十三观音堂都是景区内的热门景点，尽头的南山海上观音更是来此必看。


南山海上观音：屹立于南海之上的百米观音像
高108米的观音菩萨圣像立于南海碧波之上，这座圣像不仅是南山文化旅游区的地标，也是众多佛教信徒的朝拜圣地。观音像巍峨壮观，一体化三尊，分别持珠、持箧、持莲，寓意着慈悲、智慧、和平。游玩时除了远观近看外，还可乘坐电梯或步行登上观音像的莲花底座，摸一摸佛脚，诚心祈福。


南山寺：气势恢宏的大型寺院
南山寺是一座盛唐风格的大型寺院，其规模在华南地区首屈一指，整体气势恢宏，庄严肃穆。寺内的金门（即大雄宝殿）、兜率内院、仁王门均是必到之处。寺内有免费赠香，可以诚心一拜。


三十三观音堂：工艺精湛的观音群像
三十三观音堂内供奉着观世音菩萨的三十三种应化法身群像，造型各异，金碧辉煌，非常值得一看。在这里还可以免费抄经书，感受佛教文化的洗涤。->2023年1月21日 08:00-00:00,；2023年1月22日 00:00-17:30,（17:00停止入园）；2023年1月1日-2023年1月20日 08:00-17:30,（17:00停止入园）；2023年1月27日-2023年12月31日 08:00-17:30,（17:00停止入园）；2023年1月26日 04:30-17:30,（17:00停止入园）；2023年1月23日-2023年1月25日 08:00-17:30,（17:00停止入园）->儿童：1.2米（含）以下儿童，免费；1.2米（不含）以上及18周岁（含）未成年人凭有效证件（身份证、学生证）现场购票，半价
老人：70周岁（含）以上老人（凭有效身份证、老年人优待证），免费；60周岁（含）至69周岁（含）老人凭有效证件（身份证、老人优待证）现场购票，半价
残疾人：凭中国残联颁发的残疾证，免费
记者：凭国家新闻出版广电总局颁发的记者证，免费
军人：现役军人凭有效军官证、军队警官证、军队文职干部证、士兵证、军人离退休证、革命军人伤残证、军警院校学员证，免费
消防救援人员：消防救援人员凭有效的在职、退休、残疾消防救援人员证和消防救援院校学员证，免费
僧人：僧人凭有效证件(宗教协会颁发的戒牒证、度牒证、皈依证、居士证)，免费
补充说明：以上信息仅供参考，具体信息请以景区当天披露为准。->停车场：【南山停车场】参考价格：¥8/天；地址：景区大门口；库位：以景区实际情况为准
行李寄存：参考价格：小柜15元/次，中柜20元/次，大柜25元/次；地址：游客中心；寄存时间15小时，超出15小时加收一次费用
园内交通：参考价格：往返30元/人；地址：不二法门前进100米处；运行从不二法门至南山寺
童车租赁：参考价格：押金298元/台，租金10元/小时，超出6小时按6小时计；地址：游客中心
轮椅租赁：参考价格：押金800元/台，免费使用；地址：游客中心
卫生间：景区内设有卫生间，在景区入口等地设置有明显标志牌
母婴室：地址：景区卫生间有母婴室
餐饮：南山文化旅游区内设有多个餐厅，具体位置可询问工作人员或根据导览标示选择。
自动售卖机：南山文化旅游区内设有多个自动售卖机，可使用支付宝/微信支付。
便利店：南山文化旅游区内设有多个便利店，可使用支付宝/微信支付。"
神玉岛,五指山,保亭县响水镇毛真水库神玉岛文化旅游度假区,明日08:30开放（16:30停止售票）,0898-83885111,介绍->开放时间->优待政策,"神玉岛位于毛岸毛真水库，环湖而建，山水相依，是海南热带生态雨林的腹地，拥有山地湖泊、原始热带生态雨林、千年荔枝树、森林溪谷、亿万年活化石-桫椤丛林和桃花水母等自然奇观。依托碧玉湖和周边热带山地雨林而建，为水库型水利风景区。->全年 08:30-18:00,（16:30停止售票）->儿童：1.2米（不含）以下，免费；1.2米（含）-1.4米（含），优惠
老人：70周岁（含）以上，免费；60周岁（含）-69周岁（含），优惠
学生：全日制大学本科以下学生凭有效相关证件，优惠
残疾人：凭有效证件，免费
补充说明：以上信息仅供参考，具体信息请以景区当天披露为准。"
七仙岭温泉国家森林公园,五指山,保亭黎族苗族自治县七仙岭温泉旅游区1号七仙岭温泉国家森林公园,明日08:00开放（16:30停止入园）,0898-31833888,介绍->开放时间->优待政策->服务设施->必看贴士,"七仙岭温泉国家森林公园位于保亭黎族苗族自治县的东北边，包括温泉区和森林区两部分，其魅力在于温泉、奇峰、民族风情和热带田园风光。
七仙岭温泉国家森林公园主要分三个游览区域，七仙岭国家公园体验之旅、热带雨林猎奇之旅、探险登峰之旅。七仙岭七座山峰以似人的掌指竖立，直指苍穹，如仙女亭立，岭名由此而得。前峰高大，海拔1126米，后六峰相依而小。七仙岭地区气候温润，年平均气温23摄氏度，全山密布原始热带雨林，是天然的动植物王国。当晨雾浮盖时，远眺中的七仙岭，酷似七位姐妹披着薄纱直立，端庄窈窕；时近中午，云雾消散，此时的七仙岭又象七把利剑直指云天，气势十分雄伟。->2023年1月21日 08:00-14:00,；2023年1月22日-2023年12月31日 08:00-17:30,（16:30停止入园）；2023年1月1日-2023年1月20日 08:00-17:30,（16:30停止入园）->儿童：1.2米（不含）以下，免费；身高1.2米（含）-1.5米（不含），优惠
老人：70周岁（含）以上凭老年证或身份证 ，免费；65周岁（含）-69周岁（含）凭老年证或身份证，优惠
学生：全日制大中小学生（不含成人教育研究生）凭有效学生证，优惠
残疾人：凭残疾证 ，免费
现役军人：凭军官证 ，免费
跟团导游：凭导游证 ，免费
记者：凭记者证 ，免费->停车场：【景区停车场】参考价格：免费；地址：景区入口处；库位：100
卫生间：景区内设有卫生间，在七仙茶亭附近，并标有醒目的指示牌。
母婴室：地址：景区卫生间有母婴室->1、登山适宜时间段为每年11月至次年4月，建议避开5－10月的雨季；
2、七仙岭登山一般就只登前峰和二峰，登山道大部分铺设了石阶路，不过石阶路并不能直达岭顶，登顶的“路”是一段几十米长的峭壁，现已设有徒手攀岩区，可以沿着它攀爬而上；
3、爬到山顶再下到山脚一般需要4个小时左右，途中可准备点水和干粮。->1、登山适宜时间段为每年11月至次年4月，建议避开5－10月的雨季；
2、七仙岭登山一般就只登前峰和二峰，登山道大部分铺设了石阶路，不过石阶路并不能直达岭顶，登顶的“路”是一段几十米长的峭壁，现已设有徒手攀岩区，可以沿着它攀爬而上；
3、爬到山顶再下到山脚一般需要4个小时左右，途中可准备点水和干粮。"
槟榔谷,五指山,保亭黎族苗族自治县三道镇甘什岭槟榔谷,明日08:30开放（17:00停止售票）,"0898-38661116,0898-38660315",介绍->开放时间->优待政策->服务设施,"海南槟榔谷黎苗文化旅游区创建于1998年，地处北纬18°，位于保亭县与三亚市交界的甘什岭自然保护区境内。景区坐落在万余棵亭亭玉立、婀娜多姿的槟榔林海，并置身于古木参天、藤蔓交织的热带雨林中，规划面积5000余亩，距亚龙湾海岸26公里，距三亚市中心28公里。 槟榔谷因其两边森林层峦叠嶂，中间是一条延绵数公里的槟榔谷地而得名。景区由非遗村、甘什黎村、谷银苗家、田野黎家、《槟榔·古韵》大型实景演出、兰花小木屋、黎苗风味美食街七大文化体验区构成，风景秀丽。景区内还展示了十项国家级非物质文化遗产，其中“黎族传统纺染织绣技艺”被联合国教科文组织列入非物质文化遗产急需保护名录。槟榔谷还是海南黎、苗族传统“三月三”及“七夕嬉水节”的主要活动举办地之一，文化魅力十足，是海南民族文化的“活化石”。
﻿->2023年1月23日-2023年12月31日 08:30-18:00,（17:00停止售票）；2023年1月21日 08:30-14:00,（13:30停止售票）；2023年1月22日 09:30-18:00,（17:00停止售票）；2023年1月1日-2023年1月20日 08:30-18:00,（17:00停止售票）->儿童：1.2米(含)以下或6周岁(含)以下凭户口本等有效证件，免费
未成年人：7周岁(含)-17周岁(含)或身高1.2米(不含)-1.4米(不含)凭户口本或身份证等有效证件，半价
老人：70周岁(含)以上凭本人身份证，免费；60周岁(含)-69周岁(含)凭身份证，半价
学生：凭国内全日制本科及以下学生证，半价
残疾人：凭国家残联颁发的残疾证，免费
记者：凭国家新闻署颁发的记者证，免费
现役军人：凭有效证件(军官证、士兵证)，免费
补充说明：以上仅为景区门票的优待政策，已参加旅游团的军人、记者、学生、残疾人和60周岁(含)以上的老人等不享受优惠待遇。->停车场：【大巴车停车场、中巴车停车场、小车停车场】参考价格：免费；地址：景区旁；库位：600
WIFI：账号：i-sanya；密码：无需密码；范围：全覆盖
手机充电：在VIP大厅充电免费，若借走需付押金并收费
行李寄存：参考价格：以行李大小实际情况为准
园内交通：参考价格：往返35元/人；地址：波隆站；路线为非遗村－甘什村－苗寨
童车租赁：参考价格：5元/辆/小时，同时需缴纳500元作为押金；地址：游客中心
卫生间：景区内设有卫生间，在景区入口等地设置有明显标志牌
母婴室：地址：景区卫生间有母婴室
餐饮：槟榔谷内设有多个餐厅，具体位置可询问工作人员或根据导览标示选择。
自动售卖机：槟榔谷内设有多个自动售卖机，可使用支付宝/微信支付。
便利店：槟榔谷内设有多个便利店，可使用支付宝/微信支付。"
三亚亚特兰蒂斯C秀,五指山,三亚市海棠湾海棠北路36号,09:00-21:10开放（20:00停止售票，20:00停止入园）,"0898-88020566,0898-88986666",介绍->开放时间->优待政策->服务设施,"关于C秀——
【海洋传奇的全新梦幻打开方式】
很久很久以前，在苍茫的大海上，存在过这样一个璀璨的文明 —— 亚特兰蒂斯，王子阿特拉斯拥有一把蕴含海洋力量的三叉戟，守护着这里的一切，在他的带领下，这里的建筑金碧辉煌，科技高度发达。海洋世界中美丽的人鱼公主娜迪亚邂逅这位英俊潇洒的王子，并深深的相爱了。但是在深海中的海怪却十分嫉妒，海怪发怒要让王子的世界永不得安宁，并掳走了人鱼公主娜迪娅。
传说中只有拥有真爱、勇气和力量的人才能战胜海怪，守护公主和她们的世界。我们的故事，从这里开始……


【2022全新C秀——六大看点  震撼重启】
这是属于亚特兰蒂斯的海洋神话，中国班底、国际制作、立足三亚，以驻场秀为载体，让世界看到梦幻的定义……
【剧情跌宕】
亲历亚特兰蒂斯古国兴衰，见证美人鱼的前世今生，跨越万年的文明历险，一场无畏的追爱之旅……
【舞美梦幻】
亚洲全新的奇幻海陆空3D舞台，好莱坞级别全感官盛宴，视觉听觉触觉全方位沉浸式观剧体验！


【杂技惊险】
太阳马戏团队打造乐趣杂技，海陆空3D舞台精髓演绎，高空、陆地、水下表演直达心间，强烈的感官冲击，惊险刺激，老少咸宜。


【互动有趣】
丰富的互动贯穿全剧，让你融入舞台、沉浸在海洋梦幻中，更有海狮、海豚表演让你的爱心与童趣恣意绽放！


【周边精美】
高颜值特色衍生品，让精彩延续，把回忆带回家……
【明星献唱】
全新歌曲演绎奇幻大戏，特邀当红音乐人鱼闪闪献唱片尾曲。
别眨眼，这一刻，走进海洋奇幻梦！->2023年4月1日-2023年6月30日 09:00-21:10,（20:00停止售票，20:00停止入园）；1、演出场次：16:30场、20:00场； 2、《C秀》演出时长约65分钟->儿童：身高0.9米(不含)以下免费，不提供演出座位，一名成人可带一名儿童，免费；身高0.9米(含)~1.5米(含)，优惠
老人：年龄70周岁(含)以上，优惠
残疾人：民事残疾人凭残疾人证(盲人、生活不能自理等情况的残疾人必须有至少一名具有完全独立民事行为能力监护人陪同入园)，优惠
现役军人或持军残证军人：凭有效证件，优惠
补充说明：优惠票取票检票时需出示身份证。具体信息请以景区当天披露的为准，以上信息仅供参考->停车场：【亚特兰蒂斯停车场】参考价格：收费；地址：景区大门口；库位：以景区实际情况为准；大中型车辆临时停放首小时 8元（此后每小时4元），24小时上限40元。小型车辆临时停放首小时5元（此后每小时3元），24小时上限20元。（首小时30 分钟内免费，住店客人免费，按序排队候客的出租车免费 ，使用充电桩的车辆免费）"
鹿回头风景区,五指山,三亚市大东海鹿岭路鹿回头公园,08:00-22:00开放（21:30停止售票，21:30停止入园）,"0898-88213740,0898-88210808,0898-88211339",介绍->开放时间->服务设施,"鹿回头风景区坐落在三亚市西南端鹿回头半岛内，共有大小五座山峰，最高海拔181米。公园三面环海，一面毗邻三亚市区，是登高望海、观看日出日落与俯瞰三亚市全景的佳处。1994年，鹿回头风景区被评为风景名胜区。2017年，鹿回头风景区荣获国家4A旅游景区称号。


仙鹿回头，人间有爱——南海情山
有一位黎族青年猎手，头束红巾，手持弓箭，从海南岛腹地五指山追赶一只坡鹿经过九十九座山、九十九条河来到南海之滨。前面山巅悬崖之下便是茫茫大海，坡鹿无路可走，青年猎手正张弓搭箭，忽见火光一闪，烟雾腾空，坡鹿回过头来变成一位美丽的黎族少女，两人遂相爱并结为恩爱夫妻。此山因而被称为“鹿回头”，成为青年男女海誓山盟的情山。


海岛之最——主体景点“鹿回头”
“莫道五羊威粤秀，风流不及鹿回头”。鹿回头雕塑是我国著名雕塑家林毓豪的作品，雕像高15米，长10米，宽9米，用170多块大理石费时5年雕刻而成。三亚市也因它而得名“鹿城”。同期作品还有南京雨花台雕塑、三亚小洞天鉴真东渡群雕、广州五羊雕塑。


情山誓盟——情文化世界
由“爱”字摩崖石刻、“永结同心”、“海誓山盟”、“连心锁”、“夫妻树”、“仙鹿树”、“海枯不烂石”、“山盟碑”等景点构成的情爱文化景点群落，凸现满山都是情、满眼都是爱、满心都是感动的情爱主题。已经六届的天涯海角国际婚庆节，每年11月来自国内外的情侣们必到这里海誓山盟、永结同心、祈求百年好合、美满幸福。


圣山祈福——黎族“福”文化长廊
由“平安吉祥树”、“爱心永恒”、“祭典图”、“福魂图”、“丰收图”、“祖崇图”、“婚庆图”、“龙凤呈祥”、“蛙神雕像”等组成的黎族民俗文化长廊，营造满山都是吉祥、满园都是平安、满心都是幸福的福文化氛围。


海市蜃楼——情山夜景
“乍疑天帝撒明珠，碧水浮光银汉图。海市蜃楼恍在望，夜风习习润心舒。”近年公园引进了艺术夜景灯光和激光动画表演系统，有“空中玫瑰”、“城市之光”、“摇头灯”、“空中大炮”、“频闪灯”等灯组表演，及把公园美丽动人的爱情传说做成三维激光动画，在每星期周末晚8时放映。入夜，各色的灯光把三亚的夜空妆扮成人间仙景，而鹿回头则成为浮起城市灯海上的海市蜃楼。


城市风情——北亭观景
俯瞰三亚全景的制高点，登高望海和观日出日落的佳处。极目处，海天茫茫，帆影点点，海天胜景，滨海风情，一览无余。山、海、城、河尽收眼底。入夜，山上光影华丽，山下万家灯火，观赏美丽的三亚市夜景，心旷神怡。


福满情山——紫气东来
公园观日出地点，站在此处，极目远眺，红日初露，瀚海渺茫，云蒸霞蔚，紫气氤氲，大、小东海以犄角之势齐聚于此，灵气汇聚，福泽恩承，乃福如东海之颠，福气所聚之地，建有祈福台。我国著名书画家忘山先生为此题词。


仙迹永驻——天涯游踪
“天涯游踪”乃赖少其先生所题，赖少其先生是上饶集中营的少数幸存者之一，先生游三亚，感叹人生，今生今世历尽磨难，从集中营出来后，登临鹿回头，犹如重生。阅尽天涯，更犹如步入天堂仙境，称自己为仙人，独沾仙境，留下“天涯游踪”表达自己仙游踪迹。


仙鹿有灵——鹿苑
“古往翻山坡鹿此地痴情成美女，今来戏海梅花何时中意化仙姑”，鹿回头梅花饲养基地，于1996年建成投产，现有梅花鹿120多头，并开发鹿茸、鹿血酒、鹿胎膏等多种高级滋养的鹿产品。->全年 08:00-22:00,（21:30停止售票，21:30停止入园）->停车场：【鹿回头风景区停车场】参考价格：请以景区现场为准；地址：鹿回头风景区旁；库位：200
WIFI：账号：i-sanya；密码：无需密码；范围：景区内
手机充电：景区设有充电宝
行李寄存：参考价格：收费
园内交通：地址：景区入园处
卫生间：景区内设有卫生间，在景区入口等地设置有明显标志牌
母婴室：地址：景区卫生间有母婴室
自动售卖机：鹿回头风景区内设有多个自动售卖机，可使用支付宝/微信支付。
便利店：鹿回头风景区内设有多个便利店，可使用支付宝/微信支付。"
海棠湾,五指山,三亚市海棠区,,,介绍->开放时间,"海棠湾少了城市的喧嚣与繁闹，多了份原生态的美丽与安宁。这里特别适合就想静静地呆在酒店度个假的人群，站在这里的沙滩远眺，还能看到蜈支洲岛。
海棠湾开发得比较晚，且离三亚市区较远，所以与亚龙湾、大东海相比，这里相对去的人比较少。
沙滩上的国际连锁的高端酒店品牌不计其数，包括万达希尔顿逸林、万丽、喜来登等，且酒店设施都比较新。
三亚国际免税城也坐落于海棠湾，来此度假的同时还能享受境内免税购物的乐趣。
从海棠湾可以去到著名的潜水胜地“蜈支洲岛”，这里还有着珠江南田温泉等景区。->全年 全天开放"
