names,places,addresses,times,teles,titles,descs
大溪老街,新竹,501;502室,00:00-23:59开放,+886 3 388 2201,介绍->开放时间,"大溪老街是当地高知名度的特色街区。也保留了很古老的建筑。是集观赏，吃喝玩乐于一体的特色街区。->全年 00:00-23:59,"
北埔老街,新竹,新竹北埔乡外坪村大坪溪,09:30-17:30开放,+886 3 580 2204,介绍->开放时间,"北埔小镇的风土人情，从金广福公馆、天水堂到慈天宫，都在述说着北埔历史的风光繁华。->全年 周六-周日 08:00-18:00, 周一-周五 09:30-17:30,"
阳明山国家公园,新竹,台北市北投区竹子湖路1-20号,,+886-2-2861-3601,介绍->开放时间->必看贴士,"阳明山国家公园紧临台北都会区，全区以大屯火山群汇为主，面积11456公顷，因火山活动造成的火口湖、地热与温泉，具有研究及旅游休闲价值，受季风影响，植物相兼具高草原、矮草原、阔叶树林、亚热带雨林、雨水生植物群落，孕育台湾水韭、大屯杜鹃、蝴蝶与鸟类，阳明山公园栽植的樱花及杜鹃，使本区成为台北近郊吸引人的赏花场所。->全年 全天开放；游客中心8：30-16：30；每月末的一个星期一（遇国定假日顺延一天）及农历除夕休馆->1. 山中天气多变，建议前去游客带上雨伞和外套。
2. 山中有很多步道及石梯，建议穿舒适的鞋子。->1. 山中天气多变，建议前去游客带上雨伞和外套。
2. 山中有很多步道及石梯，建议穿舒适的鞋子。"
永安渔港,新竹,台湾省永安渔港,09:00-19:00开放,+886 3 486 1017,介绍->开放时间,"永安渔港位在桃园新屋乡南方九公里处的海岸，近年来积极发展渔港观光业。总长115公尺的拱桥有著多样化的灯幕，站在桥上的观景平台可以看着渔船进入港口，傍晚时分还可以享受海风吹拂，看著夕阳西照的暖橘彩霞，或是到观海亭观看无边际的湛蓝大海，这些美景一定会让人流连忘返。->全年 09:00-19:00,"
埔心牧场,新竹,326台湾省桃园市杨梅區,09:00-17:00开放,+886 3 464 4132,介绍->开放时间,"味全埔心牧场是大型乳牛牧场。现今的埔心牧场已经发展得相当完善，牧场早期积极绿化环境，并且建设湖滨钓鱼区、骑马场与射箭场等，娱乐设施很多，非常值得瞧瞧。->全年 09:00-17:00,"
绿世界生态农场,新竹,314台湾省新竹縣北埔鄉隘子7鄰20號,08:30-17:30开放,+886 3 580 1000,介绍->开放时间,"绿世界生态农场有许多美丽的野生动物，有鹈鹕，鹦鹉，羊驼和各式水生陆生珍奇的生物，可以近距离互动。->全年 08:30-17:30,"
慈湖陵寝,新竹,335台湾省桃園市大溪區復興路一段1097號,9:00-17:00开放,+886 3 388 3552,介绍->开放时间->必看贴士,"慈湖陵寝位于台湾桃园市大溪区，是蒋中正的陵园。陵园旁开辟了一处“铜像公园”，用以安置台湾各地因去蒋化而移除的蒋公铜像，形成特殊的装置艺术主题公园。->全年 ,- 9:00-17:00,->1. 慈湖陵寝，除了是蒋中正的陵园之外，收集了各时期蒋公塑像的公园和环境优美的自然风景都是吸引游人前来的理由。2. 每天9点起的整点还有卫兵交接仪式，园内导游关于历史的八卦也颇有趣味。->1. 慈湖陵寝，除了是蒋中正的陵园之外，收集了各时期蒋公塑像的公园和环境优美的自然风景都是吸引游人前来的理由。2. 每天9点起的整点还有卫兵交接仪式，园内导游关于历史的八卦也颇有趣味。"
桃园仙谷,新竹,桃园县复兴乡长兴村上高遶8邻5之1号 ‎,营业时间待定,+886-3-3822661,介绍->开放时间,"占地两百公顷的桃源仙谷位于桃园复兴乡，是一处拥有多种花草树木的休闲园区。每当冬春两季郁金香花海盛开美不胜收，吸引大批民众前往赏花。桃源仙谷裡种植多样花草，四季各有不同的花卉绽放，许多蝴蝶也会在花丛中飞舞，全年皆有美丽的景色。沿著枕木阶梯而下，百泉溪旁设有沙推与小型的亲水池，夏日午后不彷卷起裤管到溪畔旁戏水，赶走夏天的炎热暑气。->全年 8:00-17:00,"
石門山,新竹,"石門山, 龙潭区桃园市台湾省 325",,,介绍,石门山因位处石门水库西侧而得此名，山上有许多岔路步道，地形平缓坡度不大，步道两侧林荫蓊蓊，沿途有相思树、油桐树以及眾多的蕨类植物，空气中也弥漫著芬多精香气，相当适合全家一起来踏青。西门山地势高度550公尺，因周围无屏障视野良好，登上山顶还有一座大型观音像，站在山顶上眺望大汉溪、大溪龙潭山峦，让您细细欣赏居高临下的美景。
石牛山,新竹,台湾省新竹县关西镇,,,介绍,石牛山因为多岩石而得名，新竹地区的名山，名列台湾小百岳。
艋舺龙山寺,新竹,台北市万华区广州街211号,06:00-21:45开放,+886-2-23025162,介绍->开放时间->必看贴士,"龙山寺又称为艋胛龙山寺，台北的名刹，寺庙坐北朝南，设计采用三段式格局，由前殿、后殿、东西护宝及中央的正殿所组成，呈显一个”回”字体。上有钟鼓楼，且门壁梁柱尽显雕琢之美，特别是前殿的四根铜龙柱，堪称经典。龙山寺庙埕左右两边设有净心瀑布和喷泉水池，大殿处有金柱圆形螺旋状藻井，寺内供奉的神像甚多，主神为观音，每年农历正月15至2月19日神诞，寺内会有盛大的祭奠及花灯展览。->全年 06:00-21:45,；具体营业状态以当天开放情况为准->1. 小心防窃，龙山寺地处台北的老城区，各色人都会有，一定要小心提防。
2. 龙山寺附近的夜市基本都要到下午才开始营业，所以，如果是冲着夜市去的话，建议下午晚点前往。->1. 小心防窃，龙山寺地处台北的老城区，各色人都会有，一定要小心提防。
2. 龙山寺附近的夜市基本都要到下午才开始营业，所以，如果是冲着夜市去的话，建议下午晚点前往。"
中平路故事馆,新竹,320台湾省桃園市中壢區復興路99號,10:00-18:00开放,+886 3 425 5008,介绍->开放时间,"中平路故事館是一栋保存完好的历史建筑，十分具有特色。馆内有专业的人员讲解，可以了解这栋建筑的历史。->全年 周三-周日 10:00-18:00,"
淡水老街,新竹,台湾省新北市淡水区中正路,,+886 2 2622 1020,介绍->开放时间->必看贴士,"淡水老街位于新北市淡水区，一般所说的“淡水老街”，是指淡水镇中正路一带，含其周围邻街——三民街、重建街、真理街、清水街一带。在这里，可以见到保存下来的古建筑、屋舍。
淡水老街的特色在于这里的美食，中正路两旁林立着众多鱼丸、鱼酥店，如德裕鱼丸、可口鱼丸、味香鱼丸、许义鱼酥等；耐人寻味的〝铁蛋〞则是卤蛋反复卤制，然后蛋白缩成薄薄的黑色韧皮，气味香醇。阿婆铁蛋已有30多年历史，是淡水小镇较知名的小吃之一；〝阿给〞的作法是油炸豆腐皮中塞满粉丝，在糊上鱼浆，蒸过后浇上特制的辣椒酱，便成了这道风味特殊的小吃。吃完道地小吃后，不妨来杯酸中带甜的酸梅汤，满足口中的味蕾。
此外，淡水老街还有许多家艺品店、咖啡馆、服饰店、商店，是一条集美食、小吃、购物、休闲于一体的老街。->全年 全天开放->虽然是全天开放，但午后淡水老街会比较热闹。->虽然是全天开放，但午后淡水老街会比较热闹。"
孙中山纪念馆,新竹,台北市信义区仁爱路四段505号,09:00-18:00开放,+886-2-27588008,介绍->开放时间->必看贴士,"国父纪念馆位于台北市中心，是孙中山先生纪念馆。开馆初期，主要展出孙中山史迹相关文物，时至今日，多用于文艺表演或颁奖典礼，是大型表演场地。
国父纪念馆分为五大区，包括纪念堂、翠湖、中山公园、中山碑林和中山公园广场，建筑楼高三层，每层有其独立的功能。一楼北面是个大会堂，设有演讲厅、中山讲堂、逸仙书坊；二楼是中山画廊和孙逸仙博士图书馆，画廊经常邀请知名的艺术家在此展出；三楼设有逸仙艺廊、德明艺廊和逸仙放映室；地下一楼有翠亨艺廊、载之轩、翠溪艺廊、书报阅览室、视听中心，是台北市民室内艺文、知性活动的多元化地点。
纪念馆一楼南面设有孙中山先生的铜像，铜像两边各站了一名卫兵，由陆海空三军仪队轮派担任。每日整点换岗仪式，会由一位士官带领两位换岗卫兵，迈着高抬腿的正步从大厅左侧迈入大厅，到正面向国父行军礼。站岗卫兵走下哨位，与接岗的卫兵并列成一行，共同完成验枪等一系列动作，向孙中山先生的塑像敬礼后，接岗的卫兵走向自己的哨位，整个过程约15分钟，动作整齐划一。
纪念馆馆外是绿意盎然，垂柳迎风摇曳的翠湖；还有全长120米，采用花莲特产墨绿色小卵石所铺设的健康步道；中山公园则是受当地市民喜爱的公园之一。
如今的国父纪念馆已成为市民休闲以及欣赏艺术，文化演出的综合性场所。假日经常可见年轻学子在此排练舞蹈，也有许多市民会趁天气好的时候来此散步运动，不少摄影师也会在此摄影取景。->全年 09:00-18:00,；除夕、初一、机电保养为休馆日，具体营业状态以当天开放情况为准。->1. 看换岗仪式的拍摄位置是铜像正前方，这里可以直观看到卫兵一整套动作。
2. 每天来此观看换岗仪式的游客非常多，建议提前15-20分钟抵达大厅占据有利位置。
3. 纪念堂前的广场是与纪念堂合影的理想位置，也是拍摄对面台北101大厦的好位置。
4. 士兵交接仪式后，1楼的国父史绩展览东室有孙中山先生生平事迹简介播放，片长6分钟。10:00和14:00有孙中山先生在台相关史绩巡礼影片播放，片长28分钟。->1. 看换岗仪式的拍摄位置是铜像正前方，这里可以直观看到卫兵一整套动作。
2. 每天来此观看换岗仪式的游客非常多，建议提前15-20分钟抵达大厅占据有利位置。
3. 纪念堂前的广场是与纪念堂合影的理想位置，也是拍摄对面台北101大厦的好位置。
4. 士兵交接仪式后，1楼的国父史绩展览东室有孙中山先生生平事迹简介播放，片长6分钟。10:00和14:00有孙中山先生在台相关史绩巡礼影片播放，片长28分钟。"
新竹市风城愿景馆,新竹,东区东大路一段1号,,,景点介绍,
新竹孔庙,新竹,300台湾省新竹市東區公園路289號,明日08:00开放,+886 3 561 0421,介绍->开放时间,"新竹孔庙建于嘉庆二十二年，庙内有大成殿、棂星门和东西两庑，殿内祀孔子神位，亚圣和七十二贤分祀两侧。->全年 周二-周日 8:00-17:00,"
台湾地区领导人办公大楼,新竹,台北市中正区重庆南路一段122号,,+886 2 2311 3731,介绍->开放时间->必看贴士,"位于台北市中正区，建筑风格属于后文艺复兴风格，红色大楼庄严肃穆。一层有很多陈列室，还有很多文物展品。->全年 周一-周五 09:00-11:30, 周六-周日；具体营业状态以当天开放情况为准。->单日参观人数以600人次为上限，如果预约参观日人数已经超过600人次，则申请会被拒绝。->单日参观人数以600人次为上限，如果预约参观日人数已经超过600人次，则申请会被拒绝。"
海天一线看海区,新竹,300台湾省新竹市北区,,,开放时间,全年 全天开放
湖口老街,新竹,303台湾省新竹縣湖口鄉湖口老街,,+886-3-5695963,介绍->开放时间,"老湖口以三元宫为中心，包含“街头”、“横街”与“新街”3条街，大约在1920年，新街就是我们现在所称的湖口老街。湖口老街的房舍全部以红砖为建材，老街的建筑式样较为特殊，牌楼立面属于罗马巴洛克建筑，架构采闽南式，两侧为长条形店铺住宅。
老街房舍的内部格局因应住宅与店铺的混用，第一进为店面，第二进为住家，两进间的深井为厨房之所在。
在台湾现存的老街中，湖口老街中拱形的门廊户户相对，街屋整齐一致都设有骑楼，一楼柱节单拱走廊，二楼窗户和女儿墙间有水泥楣点缀，商号名称镌刻其上，简洁大方。走完湖口老街宛若历经一部模糊的历史。
湖口人的宗教信仰老街上有几座不同姓氏的家庙，迄今在老街尾端的三元宫一直以来是居民的凝聚中心。->具体营业状态以当天开放情况为准"
小乌来风景特定区,新竹,336台湾省桃园市复兴区小乌来风景特定区,明日08:00开放,+886-3-3821235,介绍->开放时间,"小乌来风景特定区位于复兴乡区内，「乌来」在泰雅族的母语中代表著温暖泉水的意思，小乌来风景特定区瀑布风景区旁有一四层赏瀑台可供游客欣赏。每年5-6月，与隔年11为是很合适的赏鸟季。->全年 ,- 08:00-17:00, 周二"
桃園77藝文町（桃園警察局日式宿...,新竹,330台湾省桃園市桃園區中正路77巷5號,10:00-22:00开放,+886 3 332 1969,开放时间,"全年 周二-周日 10:00-22:00,"
猫空,新竹,台北市文山区,,,介绍->开放时间->必看贴士,"猫空位于台北文山区的木栅茶区的山上，因特有的壶穴地形而得名，木栅观光茶园是全台知名的观光茶园。猫空曾是台北知名的产茶区，出产的木栅铁观音更是台湾十大名茶之一，来猫空喝茶观景已经成为台北独特的文化。
要拜访猫空，可以选择走步道或者坐缆车，胆子大的可以坐“猫缆之眼”的水晶车厢，整个车厢都是透明的，360°的美景尽在脚底。如果沿步道造访猫空，不仅可以慢赏景色，还可以避开人群，漫步于安山岩和松木栈道，沿途林荫苍翠，虫鸣鸟啭，尽享悠闲。
在猫空地区，一共有5、60家茶社，大部分店家都有独特的茶餐料理，政府官方将猫空一带按照历史、赏景和生态角度划分为红、黄、蓝三区，红区具人文历史特色；黄区登高鸟瞰台北视野开阔；蓝区则是强调生态旅游，缆车导览图上可看到区域划分，按需选择去哪里品茶。
茶社中阿义师的大茶壶茶餐厅，是猫空受邀Discovery国家地理频道专访的饭店，位于指南路三段38巷37-1号1楼。这里的菜式味道好分量足，还有很多套餐，价格也实惠。要是嫌大茶壶人太多，邀月茶坊、红木屋茶坊等也不错，还可以买点茶叶，茶叶香皂等小手信。
猫空一年四季都有美景，除了茶树外，每年1、2月份杏花盛开，茶树中夹杂的鲁冰花也会开放；4、5月份采摘春茶，油桐花也同期盛开，有“五月雪”的美称；6-9月份可以品尝到绿竹笋风味餐；12月到1月份则是冬茶收获的季节。
来游猫空，你可以顺路到指南宫、三玄宫、天恩宫、优人神鼓山上剧场等寺庙和人文景观，到指南宫俯瞰台北，去茶壶博物馆体验制茶文化，还可以去台北动物园看大熊猫圆仔！->具体营业状态以当天开放情况为准->1.猫空缆车有4站，由台北市立动物园站、动物园内站、指南宫站，终点站为猫空站。
2.乘坐缆车前先检查一下自己的身体状况，身体不适者建议不要乘坐缆车。
3.普通缆车车厢限乘8人，水晶车厢限乘5人。->1.猫空缆车有4站，由台北市立动物园站、动物园内站、指南宫站，终点站为猫空站。
2.乘坐缆车前先检查一下自己的身体状况，身体不适者建议不要乘坐缆车。
3.普通缆车车厢限乘8人，水晶车厢限乘5人。"
宏亚巧克力共和国 -,新竹,334台湾省桃園市八德區巧克力街177號,营业时间待定,+886 3 365 6555,介绍->开放时间,"位于桃园的巧克力共和国，是东南亚地区著名的巧克力博物馆，更是名副其实的巧克力国度。博物馆外观犹如一颗被剥开、融出浓浆的巧克力，光是用看的就很美味；有馆内区与户外区两部分，让游客充分认识可可豆的历史、种植环境，了解巧克力生产的过程。
除了了解巧克力知识外，重要的当然还是品尝让全世界著迷的美味巧克力。只吃不过癮，这里还有厨艺教室，在主厨一个步骤一个步骤带领下，亲手创作出充满爱的巧克力。->全年 周二-周日 10:00-18:00,"
南寮漁港,新竹,"南寮漁港, 台湾省",,+886-3-5216121,介绍->开放时间,新竹渔港位于新竹市西北郊海滨，本来是渔民谋生兴建的渔港，随著鱼源的枯竭，因而转变成休闲为主的港口。新竹近海鱼业产量丰富，四季皆有不同鱼群，更成为钓鱼发烧友的天堂，周末假日处处可见成群的钓友在此钓鱼。近十年来这里的沿海建起了观光带，不断地增加了休闲设施，给市民和游客提供成为了优质的休憩场所。->具体营业状态以当天开放情况为准
狮头山,新竹,苗栗县三湾乡狮头山,,+886-4-23312678,介绍->开放时间,狮头山位于新竹县与苗栗县之间，海拔高度约为520米，因远眺山形极似狮头而得名。狮头山的观光资源丰富，这里有独特的山形山壁，以及峨眉湖等景点，山中还坐落着十八座佛教寺庙，是百年佛教名山。->全年 全天开放
六福村野生动物园,新竹,新竹县关西镇仁安里拱子沟62号,,,景点介绍,
士林官邸,新竹,台北市士林区福林路60号,08:00-18:00开放,+886-2-28836340,介绍->开放时间->优待政策,"士林官邸背有福山倚靠，又紧邻中山北路，现在士林官邸已改为台北市的生态公园，是市民亲近绿地和休闲的好去处。
士林官邸是一座两层楼的西式小洋房，进门迎面是一个大型龙凤根雕玄关，穿堂墙上挂4幅国画复制品，桌椅家具中西合璧，地铺暗红地毯。洋房内陈设典雅简朴，一楼是会客厅，二楼是蒋宋夫妇的卧室。
餐厅有西式长桌和中式圆桌各一张，人少时就在圆桌用餐。1952年扩建的大客厅地方宽广，布置了4个中西式会客区。墙上有西式壁炉，还有4个苏州园林风格的大圆窗，其中3个可以饱览内花园秀色，1个则嵌贴宋美龄手绘的画作。
紧邻洋房的士林园艺致力于兰花培植，中式庭园里面的拱桥、曲池、流水等东方庭园造景，令人彷佛置身古代中国。欧式花园中有温室盆栽区及玫瑰园。中西两种风格同时聚合在一个地方，并没有显得突兀和怪异，却有种别样的美。
官邸出口处有一座咖啡馆，很多人都坐在咖啡馆门口的露天吧区内休憩闲谈，咖啡馆的招牌是一张很大的黑白照片。->全年 08:00-18:00,；具体营业状态以当天开放情况为准。->儿童：18周岁以下，故宫免票；5周岁及以下，士林免票
残疾人：身心残障，免费
学生：65周岁以上，士林半价"
台湾大溪花海农场,新竹,桃园市大溪区复兴路一段1093巷27号,明日10:00开放,,介绍->开放时间,"台湾大溪花海农场是台湾受欢迎的观光农场之一，偶像剧和新婚夫妇婚纱照首选取景地。->全年 ,- 10:00-17:00,；具体开放时间请咨询景区"
司马库斯,新竹,313台湾省新竹縣尖石鄉玉峰村14鄰司馬庫斯2號,,+886-5847688,介绍->开放时间,"来到司马库斯越岭主要目的在于探访台湾排名第三大的“神木”，其树种为红桧，树高约35公尺、树围约20.5公尺，形状类似烛台且须20人左右才可将神木环抱，树龄约2500年。为了保护神木的树根已在树根部分建起木造平台。
在司马库斯越岭的路线中，除了可看到时代久远的巨木群以外，枫树、樱花、竹林、扁柏和红桧林立，溪涧、碎石落盘地质可见，是台湾目前十分珍贵的山林资源，司马库斯越岭更是许多爱探险的游客的好去处。
司马库斯部落介绍
早期的泰雅族人从南投县仁爱乡往北移动，坐落于新竹山区塔克金溪东岸即为Mrqwang支族，司马库斯便是期中一个支族部落，为了纪念支族中的一位开发先烈先马库斯(泰雅语为Mangus)，便将部落名称命名为司马库斯(Smangus泰雅语纪念马库斯的意思)。
司马库斯部落至公元1979年始有电力供应，更从1991年起发展出神木群的观光契机，至今也尚保留许多泰雅族的传统生活风貌，除了原有的小米、水蜜桃等农产品以外，司马库斯亦发展出民宿、旅馆、餐厅等旅游观光业，让许多来到司马库斯旅游的民众享受自在的司马库斯旅游。->具体营业状态以当天开放情况为准"
台北101景观台,新竹,台北市信义区信义路五段7号89楼,11:00-21:00开放,+886 2 8101 8898,介绍->开放时间->优待政策->必看贴士,"台北101大楼景观台位于台北101大楼的89楼，该楼是目前全球第二大高楼，仅次于迪拜的哈利法塔，在这里可以俯瞰整个台北。想到89楼的室内观景台，需在5楼的售票区购票并搭乘电梯。该层有服务台、纪念品商店和免费寄货柜。值得一提的是，101大楼的电梯是全球快的电梯，从5楼到89楼仅需37秒。89楼的室内观景台有360度的观赏视角，还有世界高的信箱，你可以将祝福寄给朋友。91楼是户外观景台，不定期开放。登上户外观景台，仿佛天地在你脚下，真正的观景体验。从91楼下到88楼，能近距离看到世界上大、重风阻尼器，并能与它合影，还能参观全球高精品宝石艺术馆。->全年 11:00-21:00,；具体营业状态以当天开放情况为准->儿童：115公分以下，门票免票->本场所全面禁烟，并禁止口香糖或槟榔。
服装不整或穿拖鞋者谢绝入场。
请勿携带外食、宠物、违禁品及危险物品进场。
大型摄影器材未经申请禁止携带入场。
【高端服务信息】台北101景观台有快速入园，免排队直接搭乘电梯上楼->本场所全面禁烟，并禁止口香糖或槟榔。
服装不整或穿拖鞋者谢绝入场。
请勿携带外食、宠物、违禁品及危险物品进场。
大型摄影器材未经申请禁止携带入场。
【高端服务信息】台北101景观台有快速入园，免排队直接搭乘电梯上楼"
寻梦谷,新竹,桃园县芦竹乡口村,,,介绍->开放时间,"""
桃园县芦竹乡口村寻梦谷位于桃园县芦竹乡口村，四面环山，风光明媚，占地约十公顷，依地形而建，规划有游乐区、休闲露营烤肉区、度假会议寻梦谷区等三大部分。其中受人欢迎的是滑草场，由于场地广大，可以滑草和滑橇二种。寻梦谷休闲渡假两相宜，带给您如梦如幻、绝妙不同的感受。
""->全天开放"
