names,places,addresses,times,teles,titles,descs
三亚海昌梦幻海洋不夜城,乐东,三亚市海棠区海岸大道168号,14:00-22:30开放,400-601-6699,介绍->开放时间->优待政策->服务设施,"三亚海昌梦幻海洋不夜城是由海昌海洋公园匠心打造的一座集文化旅游、休闲度假、娱乐体验、新型商业为一体的沉浸式海洋主题文娱综合体，同时也是三亚的美食游乐世界。拥有13大娱乐项目、1大剧场秀、1大夜间花车巡游、每天多场环球风情演艺、多家餐厅和商铺，将海丝文化、海南文化和海洋文化巧妙结合，实现海洋文化的全域体验、开辟海洋主题娱乐休闲新领域。


【娱乐目的地——沉浸式的欢乐体验】
数十项娱乐设施让每个游客都可根据不同年龄和兴趣发现不同的游乐方式，多维度为游客打造尽兴的舒适度假体验，带你投身到奇幻的海洋世界，感受沉浸式的欢乐体验。
三亚之眼·海上摩天轮
88米高“三亚之眼”——中国南端海上摩天轮，是三亚的标志性建筑之一, 也是不夜城的闪耀招牌，共设置48个轿厢。白天的摩天轮七彩绚丽，夜间的摩天轮梦幻唯美。乘上摩天轮，饱览不夜城街景、180°国家海岸线壮景，让这座海上摩天轮不仅是观景装置，更是赋予浓烈的情感记忆、人生重要时刻的发生地。浪漫之旅，等你体验！


鲨鱼过山车
你有没有想过骑着鲨鱼疾驰大海是什么样的感觉？惊奇岛·鲨鱼过山车给你不一样的奇妙体验！全长约270米的“8”字型轨道，造型卡通的鲨鱼车厢与海洋元素的轨道站台相结合，为你营造最真实的海底世界，让你既能体验轻轻蠕动的童趣，又有狂奔俯冲的惊险！该设备非常适合全家一起打卡哦！
海昌冒险岛
以“航海探秘”为主题的室内外大型家庭娱乐中心，能同时容纳1600人体验亲子互动、角色扮演、刺激体验，高科技含量的沉浸式家庭互动娱乐。海盗主题的风格、综合配套的设施，近40余项国内外进口游乐设施已登陆冒险岛，科技感十足的VR暗黑战车等进口设备现已安装完毕，室内外三层楼场地结合,多主题多内容多类型的沉浸式体验，致力打造家庭亲子互动科普综合体。在此，全家人都可以体验精彩一天，惊喜之旅，等你开启。


飞行影院
体验270°球幕裸眼视听盛宴，领略穿梭时空，飞跃十大历史名都，重现郑和下西洋的奇幻之旅。悬挂式动感性能座椅的球幕影院，高科技的游乐项目，带来沉浸式感官冲击，一步步带你领略“海上丝绸之路”壮丽辽阔的原生风貌。


欢乐剧场
海洋实力“歌手”如何大展狮吼功？神秘嘉宾的“甜蜜kiss”是什么味道的？海洋男团如何勇夺欢乐岛？一切答案，就在欢乐剧场啦!在这里看看调皮的海洋萌宠——海狮、海狗如何在施展诙谐动作之余，展现它们万人迷的个性，更有神奇的海洋动物在线等你PK舞技。




勇敢者轮盘
象征着勇猛果敢的“勇敢者轮盘”是勇士的试炼场。伴随着动感强力的音乐，轿厢升至18米的高空并进行360°的大回转。在离心力的作用下，你还能体会到天旋地转般的体验！惊险刺激的转速，呼啸躁动的空气，冲破天际的尖叫声无不挑战着勇敢者的肾上腺素！如果你想挑战极限，测试自己的勇气，那就来试试勇敢者轮盘吧！


高空飞翔
高空飞翔项目以每秒0.8米的速度上升至50米的高空，在你俯瞰热闹绚丽的街区和远处的至美海景的时候，飞转的座椅被旋转臂带着缓缓下降，让你像在空中盘旋的鸟儿一般，切身体会到失重的刺激和自由飞翔的畅快！


非洲旋转木马
旋转木马不只是偶像剧里的特定形象存在，这里有以“非洲草原野生动物”为主题的大型单层转马。欢跃奔腾的野生动物与优美清新的音乐交相辉映，汇聚成一幅魅力四射的草原画卷，使你犹如纵情奔驰于非洲大草原，大自然的自由辽阔就在眼前浮现。奔腾之旅，等你驾驭！


波斯湾海盗船
造型靓丽，船仓摆幅大，移动速度快的海盗船，启动后从缓慢摆动到大幅度摆动,犹如游客乘船出海遇到大风骇浪，它时而冲上浪涛之巅，时而跌落波澜之谷，惊心动魄，还能将街区的全景尽收眼底，既有趣又刺激。惊险之旅，等你征服！


疯狂大转盘
疯狂迪斯科重磅登场，动感十足的音乐中，与小伙伴围坐在圆形转盘沙发上，随着圆盘的高低节奏旋转、翻滚，在律动中维持表面平静并用尽全力保持身体平衡。


星际旅行
近6米高的科幻飞碟之上，悬挂着许多精致的“飞船”。在广袤无垠的太空中，绚丽光亮的“飞船”或高或低，旋转飞跃，以每分钟6.8r的转速平缓地带领我们穿梭过去与未来，探索神秘奇妙的星辰大海。


桑巴小精灵
舞步与热情永不停歇，音乐与欢乐治愈人心！极具南美风情的座舱上下移动，7.9rpm的转速让你迈开强劲的桑巴舞步，随着音乐旋转跳跃、释放激情。绚丽的灯光，火热的气氛让你化身桑巴小精灵，感受空中狂舞的激情与热烈！


飞浪滑车
上下摆动的滑车，环绕耳边的海浪声，让你身临其境地感受到在海里飞驰的快感。滑车随着动感的音乐上升到轨道顶端后，悬空的座椅开始沿着轨道滑行。在层峦起伏间你会与轻柔的海风相拥，体验到轻缓滑动的快乐。飞浪滑车，带你开启海洋奇缘！


儿童驾校
只要速度够快，烦恼就追不上你！儿童驾校为孩子们提供了感受速度与快乐的卡丁车驾驶场地。如果你是个没有经验的新车手那也没关系，儿童驾校会为你进行培训后再上车驾驶。在驾驶结束后，孩子们还能获得园区颁发的专属证件哦！儿童驾校，让孩子也能学会驾驶知识，感受驾驶快乐！


跳伞塔
外观造型新颖的跳伞塔，运行速度平缓。乘坐在座舱内，升到几十公尺高，呼之而下，不仅可以体验忽上忽下的失重之感，还能欣赏至美海景和街区的热闹景象。小小的惊喜和刺激，让你不禁流连忘返。高空之旅，等你飞翔！
旋风碰碰车
在碰碰车上尽享飞驰畅快的童年欢乐时光，可以两人一起乘坐，感受速度与激情的双重感官刺激，打破规则束缚，在场地内尽情“飙车”，释放内心的小野兽！


疯狂大转盘
疯狂迪斯科重磅登场，动感十足的音乐中，与小伙伴围坐在圆形转盘沙发上，随着圆盘的高低节奏旋转、翻滚，在律动中维持表面平静并用尽全力保持身体平衡，等你挑战！


热带鱼湾潜水
1100㎡的热带渔湾浮潜潜水基地，10000余尾各类海洋鱼类游弋其中，看凶猛的鲨鱼在水底展缸中悠闲畅游，与温驯的护士鲨、豹纹鲨、鳐鱼等热带鱼类共同畅游嬉戏。还可探秘海底世界未知的宝藏地图，与美人鱼偶遇~更可与孩子一同体验海底的乐趣。
海豚伴游船
在蓝天下，看迷幻万千的海洋缤纷世界，与温顺、可爱的海洋精灵亲密接触。看海豚在你的身边自由自在地游动嬉戏，俏皮的海豚还将在水中“推波助澜”。




【演艺目的地——演艺圣地】
这里是24小时全天全季候永不落幕的演艺胜地，从蓝天白云下的巡游表演到光影夜晚下的绚烂焰火秀，随处邂逅国际艺术流派的街头演艺，让你沉浸在各种音乐、歌舞、表演的海洋中。


【海洋动物互动世界】
三亚海昌梦幻海洋将动物观赏与公共的开放空间相结合，一改传统的室内展示，将“逛”和“生动的内容”以新鲜的观览空间提供给游客。
海豚湾
海龟湾
热带鱼湾


【餐饮目的地——全方“胃” 全味蕾】
三亚海昌梦幻海洋不夜城中有MR.河马的烘培工坊、海棠宫·海龟湾主题餐厅、啤酒花园、蒂铂海底餐厅、沙&海等多家特色餐厅，从大众快捷的时尚简餐到美轮美奂的定制餐厅，从亲民熟悉的海南风味到惊奇的异域美食，带您领略舌尖上的世界风情。异域和本土的味觉碰撞，主题性美食餐厅与全城型海洋文化的双重体验，打造“海上丝绸之路”主题，海昌IP主题和中西方餐饮文化聚集地。
【海南特产和文创购物目的地】
三亚海昌梦幻海洋不夜城中有海岛之家、海南物语、七萌优品店、椰岛一品、一点糕、青果青橙等多家店铺，是中西方特色商品的购物集中地，也是三亚大型海南土特产购物目的地。这里还会有海上丝绸之路沿线国家的特色商品，让游客不出国门就可以购买到来自世界的正版商品。
【品牌商铺云集】


三亚海昌梦幻海洋不夜城以“海上丝绸之路”为主题设计八大湾区，每个湾区融入浓郁的海洋主题和海南元素，将“海上丝绸之路”文化传承，成就了三亚海昌梦幻海洋不夜城丰富的开放娱乐空间。在多维度商业体验的错位布局下，为游客打造一个欢乐的休闲度假体验。已进驻的品牌商铺有必胜客、肯德基、海南私房菜、喜遇港式茶餐厅、丛林盛宴、码头故事、苏荷酒吧、永涛黄花梨、海南礼物、世纪华联等。->全年 周五-周日 14:00-22:30, 周一-周四 16:00-22:30,；1、游乐项目运营时间：14:00-22:30（周五至周日），16:00-22:30（周一至周四）（具体设备开放时间以现场实际为准），冒险岛暂停开放。 2、欢乐剧场：演出时间19:00、20:30，每周一停演（以景区现场实际情况为准）。 3、飞行影院：运营时间内每半小时一场。 4、夜光花车巡游时间：21:30-21:50，每周一停演。 5、商街开放时间：10:00-24:00。->儿童：身高1.2米(含)以下，须1名购票成人陪同入园，1位成人仅限陪同1名儿童，游玩项目免费
补充说明：每名1.4米(含)以下儿童均需1名成人购票陪同，1名成人仅限陪同1名儿童->停车场：【海昌梦幻不夜城停车场】参考价格：收费；地址：景区门口；库位：1128；首小时内（含）每辆3元，首小时后2元/辆/小时（30分钟内免费，24小时上限10元）；中型车 4元/小时（30分钟内免费，24小时上线20元）
手机充电：大部分店铺配备扫码充电
景区地图：客服中心
餐饮：河马烘焙坊、海棠宫、沙与海、蒂铂海底餐厅、码头故事、聚鼎香海鲜坊、卡莉堡、大椰一粉、海南私房菜、石山乳羊、湘鄂情、喜遇茶餐厅、丛林盛宴、胡桃里、川味王、炭火亭、卓小杰、椰岛一品（不包括奶茶、水果、咖啡、酒吧）
纪念品商店： 七萌优品、海南礼物、海南物语
便利店：华联超市"
海南热带野生动植物园,定安,海口市秀英区东山镇（海榆中线27公里处）,明日09:00开放（17:30停止售票，17:30停止入园）,"0898-68526666,0898-68529999,0898-65569366",介绍->开放时间->优待政策->服务设施,"景区基本设施
海南热带野生动植物园是集珍稀野生动植物科普博览、保护繁殖、观光旅游、休闲度假为主题的国家 AAAA 级旅游景区，是一家全景式展现岛屿型热带雨林生态系统、浓缩海南岛动植物精华的天然博物馆。 海南热带野生动植物园成立于1995年，位于海口市秀英区东山镇风景秀美的东山湖畔，距海口市区仅有27公里 。 园区占地1500余亩（其中仅动物观赏区面积达1300亩），现有各种珍禽异兽100余种 ，2000多头（只）；珍稀热带植物有280科，1000多品种，热带森林覆盖率高达99%。进入景区，犹如进入了一个天然的“大氧吧”；游览过程，宛如进行了一次美妙的“森林浴”。 园内景观纯属自然天成，莽莽林海和茂密的植物为动物营造了良好的生存环境；而人工开辟的丛林小径和种植的各种奇花异草，又使游客犹如置身于鸟语花香、生机盎然的大自然中，进入一个奇丽多姿、惊险有趣的丛林动物世界。
游玩体验
景区主要分为车行游览区和步行游览区，车行游览区一改城市动物园高墙铁笼的囚兽格局，各类猛兽自然散养，游人驱车在车行猛兽区内穿行，充分体验“人在笼中兽在外”奇妙感觉。 景区明星动物主要有：国宝大熊猫、海南坡鹿、亚洲象、长颈鹿、非洲狮、东北虎、狮虎兽、白颊长臂猿、黑熊、麋鹿、猕猴、河马、黑天鹅、火烈鸟等。 景区火烈鸟餐厅占地面积 1600 平方米，能同时容纳 600 多人用餐。餐厅菜肴原料除了鲜活，还是天然的绿色食品，主要为海南本土特色菜系。->全年 周一-周五 09:30-17:30,（17:30停止售票，17:30停止入园） 周六-周日 09:00-17:30,（17:30停止售票，17:30停止入园）；中国法定节假日 08:30-17:30开放->儿童：身高1.2米（不含）以下，免费；身高1.2米（含）-1.4米（不含），优惠
老人：70周岁（含）以上凭老年证或身份证，免费；60周岁（含）-69周岁（含）凭老年证或身份证，优惠
残疾人：凭残疾证，免费
现役军人：凭军官证 ，免费
导游：凭导游证，免费
记者：凭记者证，免费
旅游运营资格证：旅游运营资格证 ，免费
全日制本科及以下学历（不含研究生及以上学历、成人教育）：凭学生证 ，优惠
教师：凭教师资格证，优惠->停车场：【海南热带野生动植物园停车场】参考价格：小轿车：5元；地址：游客中心停车场；库位：1000
园内交通：参考价格：免费；地址：票口；特殊人群，另付车费，往返20/人
童车租赁：参考价格：20元/小时
卫生间：景区内设有卫生间，有明显指示
母婴室：地址：景区卫生间有母婴室"
雷琼海口火山群世界地质公园,定安,海口市秀英区石山镇火山群世界地质公园,明日08:00开放,"0898-65469668,0898-65468989,0898-65469666",介绍->开放时间->优待政策->服务设施,"雷琼海口火山群世界地质公园位于海口市石山镇。公园拥有类型多样的火山，堪称一个天然的地质博物馆。在火山口的制高点，能够远眺海口市区和琼州海峡，风光迷人。
顺着景区的步道往里走，沿路是葱茏的热带植物，还可以看到诸如玄武岩、熔岩流等火山喷发遗留下的景观，还有一个火山石器文化园，展示2000多年前火山地区的村落用火山石堆砌的村门、制造的石磨、石碗、石盆、石桌、制蔗器等等，置身其中，仿佛回到石器时代。
步道尽头是火山神庙，立有“山岳配天”横碑和刻着“大王神”、“土地神”和“应铸神”的石碑。坡地往上有199层台阶，99代表九九重阳，100意味着走完这个火山口能长命百岁。
再往上就是马鞍岭火山口，世界上保存完整的死火山口之一，中间凹陷，突起的南北两峰分别叫风炉岭和包子岭，远远望去像一个硕大的马鞍，马鞍岭也因此得名。
沿着环山步道有5个观景点，可以观赏火山口的景色。其中，马鞍岭火山口是海口的制高点，海拔222.8米，天气晴好的时候视野很好，很多游客在这里拍照留念。另一个值得一提的观景点是前朱雀（观海口）观景台，从这里可以远望琼州海峡的碧海蓝天，看海口城市高楼林立，如孔雀开屏；往南看是热带雨林覆盖的火山群此起彼伏，风光迷人。
除了环火山口观景，你还可以沿步道进入风炉岭火口底部，这里的形状好像一口大锅，大的地方据说可以容纳万人。火口里非常凉快而且植物很多，是一个天然的氧吧，同时，还可以看到火山渣、熔岩饼、火山弹等火山喷发的遗物。->全年 08:00-18:00,->儿童：1.2米（不含）以下儿童，免费（火山口亲子乐园除外）；1.2米（含）~1.4米（含），优惠（火山口亲子乐园除外）
未成年人：18周岁（不含）以下凭身份证、学生证，优惠（火山口亲子乐园除外）
老人：70周岁（含）以上老人（凭身份证或老年证），免费；60周岁（含）~69周岁（含）|凭有效证件（身份证或老年证），优惠
全日制大中小学生（不含成人教育研究生）：凭学生证，优惠
现役军人：凭有效的军官证、军队警察证、军人文职干部证、士兵证、军警院校学员证，免费
残疾人：凭残疾人证，免费
记者：凭新闻署颁发的记者证，免费
残疾军人：凭革命军人伤残证，免费
补充说明：已参加旅游团的军人、老人不享受免费； 以上信息仅供参考，具体信息请以景区当天披露为准。->停车场：【海口火山口地质公园停车场】参考价格：收费，以景区价格现场为准；地址：海口火山口地质公园停车场；库位：500
童车租赁：参考价格：免费，但需缴纳500元作为押金；地址：游客中心
卫生间：景区内设有卫生间，有明显指示"
观澜湖华谊冯小刚电影公社,定安,海口市龙华区羊山大道19号电影公社（西线高速往观澜湖温泉1.8公里处）,09:00-22:00开放（21:00停止售票，21:00停止入园）,0898-36688000,介绍->开放时间->优待政策->服务设施,"海口观澜湖华谊冯小刚电影公社是由观澜湖集团携手华谊兄弟公司、知名导演冯小刚，巨资打造的中国独具特色的电影主题旅游胜地。
电影公社包括1942·芳华景区、南洋景区、老北京景区、美丽乡村石山村落景区、影人星光大道六大独立景区。在集纳电影场景的各个区里，还聚集了不同品牌和特色的餐饮、娱乐、购物、电影院、咖啡屋、酒吧、精品酒店……难忘的电影场景，浓郁的怀旧气氛，日与夜转换的旅游商业街区，使整个项目集建筑旅游、电影旅游、商业旅游于一体，完整展现上世纪百年间，不同时空转换的中国城市街区风情和城市街区建筑的演变史。


1942·芳华景区，以电影《一九四二》和《芳华》中的场景为蓝本，让银幕里的世界触手可及。1942景区以电影《一九四二》中的重庆街道为蓝，91栋建筑集合了上世纪二十至四十年代长江流域上海、南京、武汉、重庆四大城市典型的建筑风情，其中25栋建筑完全按照老照片复原，包括西山钟楼、重庆国泰戏院、上海融光大戏院等等，每一栋建筑背后都有一段流逝的故事，令人追忆和回味。
芳华景区是专门为2017年贺岁电影《芳华》规划建设的电影实景区，电影中80%的场景取自这里。景区内设置影壁墙、篮球场、排练厅和练功房、泳池、更衣室、道具间、军需库等。为了确保场景准确还原年代背景，景区从设计到建造陈设，从景区内随处可见的红色标语甚至到游泳池的一块瓷砖，都严格遵照上世纪70年代中国风貌和年代特色真实展现，让人身临其境。


南洋景区座落在300多米长的水岸边，集合了70幢中外建筑风格交相辉映的南洋风情建筑。其中，富有时代感的牌坊、码头、钟楼、小桥等南洋建筑集群极富意趣。南洋街充分凸显了“一带一路”和海南地域特色，不仅真实还原南洋风情建筑和街道，而且还原性呈现武馆、当铺、洋服铺、药铺、凉茶铺、饼屋等南洋市井商业风情，同时全天候的演艺让游客感受到立体多元的文化旅游体验，完整再现中国历史上三大迁徙之一的“下南洋”的盛况与繁华。


老北京景区集合老北京风情建筑集群的精华，真实还原新中国成立后至上世纪七十年代老北京城的历史韵味，高大的钟鼓楼与明清古建筑和雄伟的苏式建筑群，体现出大气、端庄、简洁的建筑审美情趣，更加原汁原味的体现老北京的文化内涵，特别融入了电影《老炮儿》里的北京胡同元素，更显京味十足。


美丽乡村石山村落景区以海口火山地区石山村落鲜明特色的建筑群，依托天然的火山坑，以灯塔为中心打造海口美丽乡村。景区以沉浸式体验为理念，把海南本土的榨甘蔗，熬红糖，制作黎族织锦等传统手工艺场景建造成实景，为孩子们打造了松鼠小剧场和动物农场饲养，出口位置的农贸集市售卖海口本地的特色农产品，充分调动游客的趣味性和参与性。以电影《非诚勿扰2》中的 “鸟巢”并加以改造酒店和仿造火山民居的主题客栈，旨在让游客重温电影中的场景，并为游客提供极具特色的住宿体验。
影人星光大道设置于电影公社正门入口的长廊，由国内一线的影视明星和导演的手印和签名组成。充分考察和借鉴好莱坞及中国香港的星光大道，采用整块大理石，通过人工切割、雕刻、打磨，制作成1.2米高的ArtDeco风格的基座，方便游客在喜爱的明星手印前拍照留念。首批呈现的80位明星手印和签名，大部分明星和导演都亲临过电影公社，包括冯小刚、葛优、张国立、成龙、刘德华、徐帆、宋丹丹、姚晨、李冰冰、廖凡、段奕宏、徐克、管虎等国内一线明星和导演。->2023年1月1日-2023年12月31日 09:00-22:00,（21:00停止售票，21:00停止入园）；各景区营业时间、《南洋往事》演出场次说明： 1、东方红景区、南洋潮景区、江城谣·芳华景区09:00-22:00。 2、演出场次：周二至周日每日2场（16:00场、19:30场），每周一休演。 3、营业及演出时间如有变动，请以现场实际情况为准。->儿童：身高1.2米(含)以下，景区门票、《南洋往事1》演出票均免费；6周岁(含)以下，景区门票免费
老人：70周岁(含)以上，凭本人身份证，景区门票免费；60周岁(含)-69周岁(含)长者凭本人身份证，日场门票优惠
青少年：6周岁（不含）-18周岁（含）凭身份证件或户口本，日场门票优惠
学生：全日制大学本科及以下学历凭学生证和身份证双证，日场门票优惠
残疾人：残疾人士凭本人《中华人民共和国残疾证》，景区门票免费
军人：现役军人、革命伤残军人、离退休军人凭本人：《军官证》、《军队文职干部证》、《中国人民武装警察部队警官证》、《士兵证》、《军人离退休证》、《革命军人伤残证》、《军警院校学员证》及国家综合性消防救援队伍人员凭有效证件，景区门票免费
带团导游：本人持国家旅游局颁发的《电子导游证》及含有本景区有效行程单，景区门票免费
补充说明：1、免票人群可享日场门票和夜场门票均免费。优待人群可享日场门票优惠政策，夜场门票票无优惠。 2、《《南洋往事1》演出票仅身高1.2米(含)以下儿童免费，其他人群无优惠。 2、以上信息仅供参考，具体信息请以景区当天披露为准。->停车场：【观澜湖华谊冯小刚电影公社停车场】参考价格：5元/辆；地址：观澜湖华谊冯小刚电影公社售票处；库位：以景区实际情况为准
行李寄存：参考价格：以行李大小实际情况为准
卫生间：景区内设有卫生间，在景区入口等地设置有明显标志牌
餐饮：观澜湖华谊冯小刚电影公社内设有多个餐厅，具体位置可询问工作人员或根据导览标示选择。
自动售卖机：观澜湖华谊冯小刚电影公社内设有多个自动售卖机，可使用支付宝/微信支付。
便利店：观澜湖华谊冯小刚电影公社内设有多个便利店，可使用支付宝/微信支付。"
文笔峰,定安,定安县龙湖镇丁湖路,明日08:00开放,0898-66288075,介绍->开放时间->优待政策->服务设施,"文笔峰位于海南省定安县的中部，这里山色秀美，植被茂密，更是鼎鼎有名的道教文化旅游区。道教南宗的创始人、南宗五祖白玉蟾正是归隐于此，沿山分布着众多道家殿宇，如玉蟾阁、财神殿、文昌阁等。电影《私人定制》还曾来此取过景。


文笔峰并不是很高，景区内也设有观光车，可以根据自己的体力和时间情况进行选择。上山途中随处可见道教文化的标志，气势恢宏的玉蟾宫、八仙贺寿的石刻、寓意丰富的道家壁画等，每一处都值得慢慢领会。


除了道教文化，这里还和盘古文化有着不解的渊源，传说中文笔峰是盘古开天辟地后出现的第一座山峰，是由盘古的鼻梁化成的，因吸纳天地之精气，所以成为了祥瑞之地。->全年 08:00-18:00,->儿童：身高1.2米（不含）以下，免费；身高1.2米（含）-1.4米（不含），优惠
老人：70周岁（含）以上凭老年证或身份证，免费；60周岁（含）-69周岁（含）凭身份证，优惠
残疾人：凭残疾人证，免费
现役军人、伤残军人、退休军人：凭有效证件，免费
警察：凭警察证，免费
学生：全日制大中小学生（不含成人教育研究生）凭学生证，优惠->园内交通：参考价格：往返18元/人；地址：景区入口处；路线为票口至玉蟾宫
母婴室：地址：景区卫生间有母婴室"
