names,places,addresses,times,teles,titles,descs
青铜峡黄河大峡谷,海原,吴忠市青铜峡市青铜峡镇（距银川市区65公里）,明日08:30开放,400-996-0953,介绍->开放时间->优待政策->服务设施,"青铜峡黄河大峡谷旅游区位于宁夏吴忠青铜峡市青铜峡镇，距吴忠市区20公里，为石灰岩和砂页岩构成的黄河峡谷类风景区，是国家AAAA级景区。“天下黄河富宁夏，塞上明珠青铜峡”。青铜峡黄河大峡谷旅游区位于宁夏回族自治区青铜峡市，景区面积126平方公里，国家4A级旅游景区、世界灌溉工程遗产核心区，全国重点文物保护单位、全国科普教育基地，地处贺兰山下，黄河岸边，是宁夏黄河金岸旅游带的核心区，旅游区资源富集，历史文化源远流长，自然景观更是秀美奇绝。“十里长峡·黄河之魂”，青铜峡黄河大峡谷是黄河上游最后一道峡谷，贺兰峻岭与牛首奇峰，构成了山的画卷，高峡平湖与深谷湍流，汇成了水的交响。雄伟壮观的拦河大坝、古老神秘的一百零八塔、汉风古韵的大禹文化园、风光旖旎的十里长峡等众多景点分布两岸，使这里成为黄河文化精品景观最靓丽的风景线。为了打造黄河流域生态保护和高质量发展先行区，旅游区特推出了十里长峡观光游，皮筏漂流体验游、健身徒步康养游、引黄灌溉研学游、千年古塔探秘游、大禹精神寻访游、拦河大坝水工游等特色体验项目，全方位展现了黄河文明的博大精深，在国内乃至国际上具有较高的知名度和美誉度，吸引了来自五湖四海的朋友徜徉其中，流连忘返。青铜峡黄河大峡谷，一个天造地设的人间胜景，一个交织着自然雄浑和人文底蕴的地方。让我们纵览黄河文化润养的山水、人文，在黄河流淌的峡谷里静静感受青铜峡的水韵传奇。->全年 08:30-17:00,->学生：1.3米(不含)以上或全日制本科及以下学生持学生证凭有效证件，优惠
儿童：1.3米（含）以下，免费
老人：60岁以上凭有效证件，免费
残疾人：凭有效证件，优惠
现役军人：凭军官证，免费
跟团导游：凭导游证，免费
补充说明：仅供参考，详情以景区为准。 优待政策只针对景区门票。->停车场：【古镇停车场、码头停车场、108塔停车场和大禹文化园停车场】参考价格：小车为5元/辆，大车为10元/辆。；地址：青铜峡黄河大峡谷景区；库位：560
WIFI：账号：黄河大峡谷景区；密码：连接即可登录；范围：游客中心、游船码头和108塔区域
手机充电：位于游客中心
行李寄存：
景区讲解：讲解员实行收费制，每位讲解员讲解费用为100元
景区地图：景区有手绘地图和全景导览图
园内交通：参考价格：2元/人
童车租赁：参考价格：押金为500元/人；地址：游客中心
雨具租赁：参考价格：押金100元/人；地址：游客中心
轮椅租赁：参考价格：押金500元/人；地址：游客服务中心
卫生间：游客中心、游船码头、108塔和大禹文化园均有AAA级旅游厕所，且均设置第三卫生间。
吸烟区：地理位置：景区游览区域设置吸烟区和非吸烟区，明确设置标识牌
母婴室：地址：游客中心提供
残障通道：景区各景点都设置残障通道
ATM机：景区售票厅均有ATM机
纪念品商店：位于游客中心
自动售卖机：游客中心和游船码头安装
便利店：游客中心商品展示中心、108塔和大禹文化园商品店"
兰州黄河游轮,海原,兰州市七里河区南滨河东路532号,明日13:00开放,0931-8455399,介绍->开放时间->优待政策,"乘坐游轮，荡漾在母亲河——黄河上，两岸是中山桥、黄河母亲、白塔山等兰州的著名景点。如果是夜晚，还能在船上感受古城的璀璨夜景。->全年 13:00-21:00,->补充说明：1、景区暂无优待政策，具体请以景区当天公示为准。"
伏羲庙,海原,天水市秦州区伏羲路110号,明日08:00开放,0938 823 0242,介绍->开放时间->优待政策,"伏羲庙本名太昊宫，俗称人宗庙，始建于明成化十九年至二十年间(1483-1484年)，前后历经九次重修，形成规模宏大的建筑群，是中国国内有伏羲塑像的伏羲庙。伏羲庙临街而建，院落重重相套，四进四院，宏阔幽深。庙内古建筑包括戏楼、牌坊、大门、仪门、先天殿、太极殿、钟楼、鼓楼、来鹤厅共10座。整个建筑群坐北朝南，依次排列，层层推进，庄严雄伟，具有鲜明的中国传统建筑艺术风格。由于伏羲是古史传说中的第一代帝王，因此建筑群呈宫殿式建筑模式，为全国规模大的伏羲祭祀建筑群。每逢正月十六伏羲诞辰日，周边群众扶老携幼，纷纷前来伏羲庙朝拜祭祀“人祖爷”。一时宝烛辉煌，香烟缭绕，钟鼓鸣天，善男信女异常虔诚，庙内充满着一派庄严肃穆的景象。->全年 08:00-17:40,->儿童：身高1.2米（不含）以上且年龄18周岁（含）以下，半价
老人：持甘肃省人民政府颁发的老年证的老人，全国70岁以上的老年人，凭有效证件在游客中心换取免费参观券后，可进入景区参观，免费；60岁以上老人，半价
学生：全日制大中小学生（不含成人教育、研究生），需持学生证，且年龄限制为：18岁（不含）-23岁（不含），半价
军人：现役军人，凭有效证件在游客中心换取免费参观券后，可进入景区参观，免费
残疾人：凭有效证件在游客中心换取免费参观券后，可进入景区参观，免费
记者：持国家新闻出版总署颁发的记者证，凭有效证件在游客中心换取免费参观券后，可进入景区参观，免费
本地市民：持天水本地身份证的市民，半价
补充说明：以上信息仅供参考，具体信息请以景区当天披露为准。"
关山草原,海原,宝鸡市陇县关山店子村,,"0917-4658885,0917-4589819",介绍->开放时间->优待政策->服务设施,"关山草原景区位于陕西陇县西南部，处在宝鸡、平凉、天水三城市几何中心。景区面积420平方公里，整体南北长约50公里，东西绵亘32.5公里，地势南高北低，平均海拔在2200米左右，是我国内陆以高山草甸为主景、极具欧陆风情的国家AAAA级旅游景区，是美丽中国全域旅游优质自然景观景区、美丽中国春天100景人气十佳景区、美丽中国全域旅游优质康养景区、省级旅游度假区、省级中小学研学旅行教育实践基地、省级就业扶贫示范基地、“丝绸之路·神奇西北”100处摄影地、艺术写生创作基地、婚纱旅拍基地、中国十大爱情联盟、中国清凉联盟创始成员单位。素有“皇家牧场”、“天然凉都”之美誉。在这里可以不出国门，观赏到具有欧陆风情的生态景观，是人们消夏避暑、休闲娱乐、疗养康体、体验民族风情、感受历史文脉的旅游胜地。
关山草原景区生态完好、资源丰富。景区内有天然森林104万亩、草地35万亩，骏马5000多匹，林草覆盖率98.7%，年降雨量700mm，负氧离子平均5716㎝³。有野生动植物1340余种，红豆杉及“秦岭六宝”中的林麝、金钱豹、细鳞鲑等国家一、二级重点保护动植物26种，保护动物林麝400多头。这里冬长夏短，春秋相连，年平均气温5.4℃，最热月平均气温25℃左右，气候凉爽温润，舒适宜人，是名副其实的“天然大空调”。景区是集山峦槽谷、原始森林、高寒草甸、河流山谷等地貌景观于一体的立体草原，可谓“百里关山，千幅画卷”。
关山草原景区历史悠久、文化厚重。秦非子牧马生息，秦襄公在此建都，秦始皇西巡，汉武帝设置大震关，唐王李世民在此骑射狩猎，这里是大秦帝国兴国之地，大汉王朝安邦之地、六朝疆域的西北门户，丝绸之路西出长安第一雄关。张骞出使西域、文成公主和亲、霍去病征战匈奴、李世民迎娶长孙皇后的故事不胜枚举。关山草原是农耕文化与游牧文化的分界线，古往今来文人墨客留下无数动人诗作。王昌龄《从军行》“更吹羌笛关山月”，王褒《关山篇》“从军出陇坂，驱马度关山”等。五代关仝《关山行旅图》是我国山水画发展史的里程碑，汉乐府横吹曲名《关山月》是民族乐曲中的瑰宝。
关山草原景区风景秀丽、四季如画。放眼关山，草是标志马是魂。连绵起伏的山丘、成群的牛羊、奔腾的骏马尽收眼底。走进关山，山峦突兀，槽谷柔和曲美，森林草原郁郁葱葱，林草山溪相得益彰。举目四望，白云漂浮于蓝天，骏马奔驰于草原，侧耳聆听，松涛阵阵，山泉叮当，林涧鸟鸣，流水潺潺，清澈见底，清冽甘甜，让人充分感受到大自然的无穷魅力。关山骏马、关山日出、关山明月、关山薄雾......在这里您看到的每一景都宛如一幅生动灵气的自然山水画。春天，芳草吐蕊，群马长嘶；夏日，水肥草美，神清气爽；深秋，红叶似火，层林尽染；寒冬，冰清玉洁，美不胜收。古人曾以“陇坂满目皆千仞，唯有关山以秀媚”的诗句来描写关山草原秀丽的风光。
关山草原景区设施完备、项目独特。游客服务中心、风情小镇、观光环线、房车营地、蒙古部落、树屋酒店、八旗烧烤园等一大批基础设施配套完善，引进深圳锦绣中华管理团队加盟管理运营，景区综合接待能力、经营管理服务水平逐年提高。宛若童话世界的房车营地、欧陆风格的风情小镇、秦氏风格的古帐营，独树一帜的树屋酒店，都能带给您独特的栖居体验。景区内骑马、射箭、滑草、滑索等娱乐项目惊险刺激；史诗级马战神话实景剧目《大秦关山》、陇州社火、篝火晚会等演艺节目精彩绝伦；6台美国星特朗号天文望远镜让您领略浩瀚星空；烤全羊、山野菜等特色美食令人回味无穷。
关山草原景区人气爆棚、闻名遐迩。连年举办国际风筝艺术节、“浪漫七夕·情定关山”大型集体婚礼、“嗨啤怡夏·纵情关山”草原啤酒节、“唱支山歌给党听”草原音乐会等特色活动，被中央电视台、海内外等媒体多次专题报道。研学旅行、亲子活动、拓展训练如火如荼，景区上演的国家非物质文化遗产的陇州马社火，被誉为“黄土地上的狂欢节”。中央7台录制的《大美关山·生态陇州》、《乡约陕西陇县》特别节目全国热播，中央三套大型综艺节目《喜上加喜》在关山草原成功录制，央视纪录片《周风秦韵 山水宝鸡》在香港卫视《美丽中华行》栏目首播。景区年接待游客130万人次，来自日韩欧美等国际旅游者人数达到6.2万人次。未来我们将持续举办草原音乐节、集体婚礼等节庆活动，不断扩大景区的美誉度和影响力。
按照新一轮《关山草原景区总体规划》，关山草原景区将以立体草甸为生态基底，诗画天堂为文化意境，以观星、赏月、骑射、穿越、游牧、研学、乡野等休闲体验与诗意的栖居体验为特色，建成中国最有诗意的草原度假综合体，向打造国际品质的中国西部最佳旅游目的地全力迈进。
绿水青山就是金山银山！大美关山·诗画草原，欢迎各位朋友的到来！
白天在景区可以观赏辽阔壮丽的自然风景，体验骑马、射箭、滑草等娱乐项目，晚上还能住在蒙古包内，体验一晚特色住宿，品尝关山草原烤全羊及其它美味小吃，感受草原人的生活。->全年 全天开放->儿童：身高1.2米(含1.2米)以下的儿童，免费；身高1.2米（不含1.2米）至1.5米的儿童享受门票半价优惠政策（30元/人），优惠
老人：65周岁（含65周岁）以上持本人居民身份证或陕西省敬老优待证，免费
学生：持全日制大学本科及以下学历在校学生证的学生享受门票半价优惠政策（30元/人），优惠
残疾人：残疾人（持本人有效残疾证），免费
退役军人：退役军人持退役军人优待证享受门票半价优惠政策（30元/人），优惠
现役军人：役军人（含军队离退休干部）、军官证（离退休证）、士官证，免费
现役军人家属：现役军人本人所携的配偶及18周岁以下未成年子女（需凭结婚证、户口本等有效证件），免费
“三属”人员：“三属”（烈士遗属、因公牺牲军人家属、病故军人遗属）人员（需凭优待证）享受现役军人的同等优待政策，免费
消防救援人员：消防救援人员（含离退休）凭有效证件享受现役军人的同等优待政策，免费->停车场：【关山草原景区内停车场】参考价格：10.0；地址：关山草原游客服务中心及景区内；库位：/；自驾车辆停车票收费标准：小车10元/辆，19座以下中巴车辆15元/辆，19座以上大巴车20元/辆。
手机充电：游客服务中心内提供移动充电宝租赁
景区地图：游客服务中心内可免费领取纸质景区导览图
卫生间：游客服务中心、停车场及景区内设有多处卫生间，均有指示牌提示
餐饮：景区内设有餐饮中心（烤全羊、山野菜等），有醒目指示牌，现金、支付宝及微信均可支付
便利店："
吐鲁沟国家森林公园,海原,兰州市永登县连城兰州吐鲁沟国家森林公园,明日08:30开放,"0931-6423851,0931-6530015",介绍->开放时间->优待政策->服务设施,"吐鲁沟在古蒙语中意为“美好的果园”，是兰州周边的一处山清水秀的自然风景区，距离兰州城区约200多公里车程，是兰州市本地居民周末郊游放松的好去处。
吐鲁沟内因为受到山地气候的影响非常湿润，这里树木非常茂密，而山沟则峰峦叠嶂，有很多形状各异的陡峭石壁，还有草原风光，景色非常优美。来此游玩主要是漫步在峡谷、草原和山间，观看众多的峰峦、石崖、草原等，另外，这里春天开有野花，秋季也有红叶，摄影也非常不错。
景区内共分为三岔村、大吐鲁沟、小吐鲁沟和草原游览区四处，游客进入景区后，可以乘坐区间车（车费30元），首先到达三岔村，三岔村处有两条向前的岔路。一条通向大吐鲁沟，这里是以奇特的地貌为主的一条峡谷，有很多漂亮的石崖、岩壁等，在大吐鲁沟的路继续向前，则可以看到沟掌草原，也就是景区的草原旅游区，可以观赏到开阔的草原风光。三岔村的另一条岔路则通向小吐鲁沟景区，这里以茂密的树木花草为主，环境很清幽，适合观景漫步。游玩整个景区大约需要大半天时间。->全年 08:30-17:30,；8:00-18:00->儿童：身高1.2米以下，免费；身高1.2米以上，优惠票
老人：60周岁以上老年人凭老年证，免费
学生：凭学生证，优惠票
残疾人：凭残疾证，免费
军人：凭军官证，免费
补充说明：1、凭短信入园参观，景区不提供纸质门票，敬请谅解。 2、以上信息仅供参考，具体信息请以景区当天披露为准。 3、购买门票享受景区内所有游乐设施全部半价优惠。->停车场：【兰州吐鲁沟国家森林公园停车场】参考价格：收费；地址：兰州吐鲁沟国家森林公园景区门口；库位：以景区实际情况为准"
兰州极地海洋世界,海原,兰州市七里河区建西东路303号（时代·海德堡庄园）,明日09:30开放,0931-2885892,介绍->开放时间->优待政策->服务设施,"兰州海洋极地世界与2016年初开业，是兰州海洋极地主题公园，园内有各种海洋极地动物，还有特色的表演、游乐项目，适合亲子、家庭出游。->全年 周一-周五 09:30-17:30, 周六-周日 09:00-18:00,->儿童：身高1.2米以下(含)，免费；1.2米（不含）以上，18周岁（不含）以下，优待票
老人：60周岁以上老人（含）至70周岁以下（不含），凭身份证或老年证，优待票；70周岁及以上老人，免费
学生：全日制本科(不包含研究生)及以下学历在校学生（不含成人教育）凭学生证，优待票
残疾人军人：残疾人、军人，凭残疾证或军官证、士兵证、士官证，半价
记者：限本人持又国家新闻总署颁布的正规记者证，半价->停车场：【兰州极地海洋世界停车场】参考价格：￥5/小时；地址：甘肃省兰州市七里河区建西东路303号 兰州极地海洋世界门口；库位：300
手机充电：游客服务中心处配备充电电源插座
行李寄存：参考价格：免费
卫生间：景区内设有卫生间，分别在停车场、游客服务中心等设施附近，并标有醒目的指示牌。
纪念品商店：园内设有纪念品商店，在兰州极地海洋世界出口附近并标有醒目的指示牌。"
贺兰山风景区,海原,银川市西夏区102省道,,,介绍->开放时间->必看贴士,"“驾长车，踏破贺兰山缺……”，贺兰山因为岳飞的《满江红》而闻名天下。贺兰山的东部为半农半牧区，西部为纯牧区。


在贺兰山东部（宁夏部分），有几千年前游牧民族留下来的岩画（贺兰山岩画）；还有西北干旱地区少有的森林公园（苏峪口国家森林公园），林木一望无际，冬天这里也是赏雪的好地方；这里还有西夏古塔（拜寺口双塔）、西夏开国皇帝李元昊的行宫（滚钟口）以及明代长城（三关口）的遗迹。




外省市游客，多数是先到银川市，然后从银川市区出发前往贺兰山的各个景点，一般当天都是回到银川市区住宿。


贺兰山中的各个景点距离银川市区较远，往返加上游玩时间一般需要一整天（多数游客会挑选2-3个景点）。在每年的4月-10月期间，银川市区的新月广场每天有旅游班车，其它时间只能包车前往。->全年（冬令时） 09:00-17:00,（16:30停止入园）；全年（夏令时） 08:30-18:30,（17:00停止入园）；具体营业状态以当天开放情况为准。->1. 贺兰山的大部分景点都比较荒凉，距离市区路程较远，游玩时带些干粮和矿泉水。
2. 贺兰山的夏季，太阳照射非常强烈，避免正午时分在户外长期活动。
3. 这里全年都比较干燥，注意随时补充水分，特别是对于来自南方的游客。->1. 贺兰山的大部分景点都比较荒凉，距离市区路程较远，游玩时带些干粮和矿泉水。
2. 贺兰山的夏季，太阳照射非常强烈，避免正午时分在户外长期活动。
3. 这里全年都比较干燥，注意随时补充水分，特别是对于来自南方的游客。"
火石寨国家地质（森林）公园,西吉,固原市西吉县城北15公里处,明日08:00开放,"0954-3906999,400-679-1996",介绍->开放时间->优待政策->服务设施,"每当春夏时节，满山遍野花草丛生，色彩斑斓，蜂恋蝶舞，生机盎然。在稀疏的林木间，还生长着一簇簇箭竹，为北方山水增添几分南国姿色。在火石寨方圆百里之内，分布着许多大大小小的兀立山峰，其中著名的有扫竹岭、石寺山、照壁山等，尤以天然石城最为奇特。火石寨不但有令人神迷的自然景观，还有十多处石窟建筑，它是和须弥山石窟一脉相承的。
禅佛寺石窟与须弥山相连，又称“须弥山禅佛寺”，为唐朝佛教禅宗派流传圣地。石窟凿造在一座尖顶宝塔式的石峰上，石峰高约120米，犹如长矛刺天，四壁悬空，奇特异常。若攀上峰顶，云雾飘然脚下。石峰东西现存石窟10孔，残存壁画、石雕须弥座等。其中最大石窟在距峰顶15米处，呈长方平顶式，当地居民供泥塑神像三尊。在石峰下半部有一石窟，深15米，宽4米，高5米，洞内能容纳百余人。石窟主峰四周奇峰怪石或崛起凌空，或沉落幽谷，形态各异。
扫帚岭石窟位于火石寨乡南5公里的石峰群中，因山岭上生长做扫帚的毛竹而得名，亦称“云台山”、“西武当”。这里林木葱茏，流水清澈，特别是奇特高耸的石山给人以“桂林山水”的感觉。山峰神态仙姿，颇具风彩。扫帚岭主峰四面绝壁，惟东北角有人凿石阶可攀，神奇的自然景观和山上人文建筑融为一体。
玉皇阁、大佛殿、菩萨殿、牛王殿、万寿宫等洞窟30多孔分布在东西长约330米的石壁上，窟室多为长方形平顶式，为圆形穹窿顶。长方形大佛殿深9米，宽6.1米，高5.45米。石窟内造像多数已毁，残存石雕须弥座、佛龛、壁画。较完整的石雕像4尊，最大的是身高4.8米，腹围4.4米的立佛。石窟内还有3尊铜佛像，其一为北魏太武帝拓跋焘时（424年-452年）所造；其二是宋代释迦牟尼鎏金铜像，高46厘米，重18公斤。->全年 08:00-18:00,->老人：60周岁含以上凭老年证或身份证或者台湾通行证，免费
儿童：1.2含以下，免费
残疾人：凭残疾证免门票，凭残疾证免门票
军人：凭军官证免门票，凭军官证免门票
跟团导游：凭导游证，免费
记者：凭记者证免门票，凭记者证免门票
学生：全日制大中小学生（不含成人教育研究生），半价
补充说明：以上信息仅供参考，具体信息请以景区当天披露为准。->卫生间：景区内设有卫生间，分别在北门、刀背岭、定福宫、休闲广场、南门等设施附近，并标有醒目的指示牌。
餐厅：园内设有餐厅，分别在休闲广场等附近并标有醒目的指示牌。"
