names,places,addresses,times,teles,titles,descs
汉阳陵国家考古遗址公园,咸阳,西安市咸阳国际机场专用公路东段,今日08:00开放（17:00停止入园）,"029-62657530,029-62657588,029-86031470",介绍->开放时间->优待政策,"汉阳陵国家考古遗址公园位于西安市北部的咸阳市渭城区，是汉景帝刘启和皇后王氏同茔异穴的合葬陵园。汉景帝刘启（公元前188-141年）是西汉第四位皇帝。执政期间，他和亲匈奴，与民休息， 与其父汉文帝刘恒共同开创“文景之治”，为其子汉武帝刘彻开疆拓土奠定了雄厚的基础。汉阳陵目前开放的区域分为北区和南区，游客从位于北区的售票处购票入内。两区之间有观光车相连（车费包含在门票内），约20分钟一班，如果你步行往来，约需10分钟。
进入景区后，首先看到的是一个高耸的封土堆，这就是汉景帝的陵墓，需要注意的是，景帝陵墓并没有被发掘（或许被盗过），在景区内参观的“地宫”（地下博物馆）并不是封土堆下的真正的地宫，而是周边的一些陪葬坑；在景区内看到的文物，也是从陪葬坑中发掘的。封土堆不对外开放，游客不能攀登。
在陵园的北区设有地下博物馆（帝陵外藏坑遗址保护展示厅）和南阙门遗址保护展示厅，前者是参观的重点。地下博物馆使用玻璃幕墙和玻璃通道，将游客和文物完全分隔在两个不同的温湿度环境中。当你走入墓道进入博物馆后，会发现一个个陶俑和瓦罐就陈列在你的面前，你还可以低头向下望去，你的脚下是数以万计的文物，各种造型的陶俑，有士兵俑、歌舞俑、宫女俑、动物俑等，这些陶俑只有真人的1/3大小，还有当时的生活器皿、车撵马具等，加上四周的昏黄灯光，会产生一种不真实的穿越感。你在这里还能观看到滚动播放的“幻影成像”节目，节目中演绎了当年丰富多彩的宫廷生活，节目长约20分钟。
距离地下博物馆不远处矗立着高大的“南阙门遗址”保护厅，这座保护厅内就是“阙门遗址”，这里有两千多年前的柱础石，黄土墙上保留着当时的楼梯、砖瓦。而保护厅本身是一座仿汉式阙门建筑，展示了汉代帝王才可享用的“三出阙”高台的雄伟高大。
陵园的南区有考古陈列馆和宗庙遗址等景点。陈列馆中主要陈列了从陪葬坑、墓中发掘出土的文物。你能看到青铜兵器，如矛、剑、箭等，钱币、陶制罐、铜镜等生活用品。除此之外，最吸引的是大量的陶俑，有骑兵、武士、侍从等，最有特色的是一部分女性骑兵俑，其中有些女兵五官比较独特，颧骨突出，眼角上翘，有人认为这是汉朝军队中的少数民族女士兵。
陈列馆以西是宗庙遗址，也就是“德阳宫”遗址，规模很大，但没有地面建筑，只能看到整理过的挖掘现场。->2023年3月1日-2023年11月30日 08:00-18:30,（17:00停止入园）；2023年12月1日-次年2023年2月28日 08:30-18:00,->儿童：6周岁（含）以下，持本人户口薄或《出生证》或身高1.2米（含）以下，免费；6周岁（不含）至18周岁（含）未成年人，半价
老人：65周岁（含）以上，持老年证及身份证，免费
学生：该票种适用于全日制大学本科及以下学历在校学生（需出具有效学生证），半价
军人：持军官证，军残证、现役军人配偶、子女持相关证件、三属（烈士、因公牺牲军人、病故军人遗属）凭本人优待证，免费
退役军人：凭本人优待证件，半价"
永兴坊,咸阳,西安市新城区中山门（小东门）内,,029-87457788,介绍->开放时间,"永兴坊是唐长安城108坊之一，位于小东门里西北角，紧邻城墙，这里在唐太宗时期，是宰相魏征的相府。如今这里成为了西安城内新兴的网红打卡地之一。


永兴坊分为关中街、陕北街、陕南街。来到这里，可以尝遍到陕西不同地域的美食。这里也是陕西非物质遗产美食文化一条街，闻名全国的西安摔碗酒也诞生在永兴坊。->全年 全天开放"
《驼铃传奇》秀,咸阳,西安市浐灞生态区华文路1518号,今日17:30开放,029-86729999,介绍->开放时间->优待政策,"华夏文旅西安度假区项目包括西安华夏文旅大剧院、西安华夏文旅海洋公园、西安华夏文旅水世界、西安先祖部落景区及餐饮商业等配套设施。华夏文旅大剧院上演会跑的实景演艺《驼铃传奇》秀，首创旋转行走式观众席，将现代高新科技与驼道丝路的传奇历史文化经典相融合，给观众带来超凡的视觉体验和心灵震撼，以正能量传播西安最辉煌历史时期的文化传奇。
西安华夏文旅大剧院作为华夏文旅西安度假区项目的标志性建筑，设计为一座长142米，宽128米，高约50米的大型椭球体建筑物，可容纳3000人同时观看演出。剧场中央巧妙设计并修建一座可移动观众席，打破了世界单一舞台演出模式，通过旋转行走看台将观众送至观演位置，带给观众全新的视听享受。
会跑的实景演艺《驼铃传奇》秀，在编撰《驼铃传奇》秀的过程中，以“一带一路”为主线，深入挖掘大唐传统文化，追寻驼队丝绸之路上的踪迹，以正能量传播西安最辉煌历史时期的文化传奇。整场演艺分为序幕《岁月再现》及《送君千里》、《狼道遇险》、《异国风情》、《祥雨洗尘》、《迎郎归来》、《华夏盛世》七幕剧情，以“好看、好听、好玩”为宗旨，打造出一部面向大众、雅俗共赏、喜闻乐见、大快人心的演艺。演出情节设计以一对新婚燕尔的夫妻《送君千里》依依惜别开场，讲述西行驼队一路经历火山、雪崩、风沙、大漠等自然险阻以及狼群突袭，九死一生；随后满载货物返程，途中祈福巴米扬，巧遇天降圣水，在亲人的期盼中安然回到长安，期间也穿插描述异域风土人情；整场演出跌宕起伏，为观众带来震撼、刺激、唯美、欢快的视听感受，使用发明专利多达47项，骆驼、苍狼在其中也有惊险刺激的表演。《驼铃传奇》秀带你穿越大漠风沙的豪迈与苍茫，倾听丝绸之路上悠远驼铃的清脆与神秘，品味异域风情，见证荣耀大唐，聆听华夏千年回响。->全年 17:30-18:00,；（具体演出时间请以景区当天实际为准）->儿童：1.2米(不含)以下儿童随成人观演免费，无单独座位安排，超出1.2米(含)以上儿童需购买成人票；1名成人仅限携带一名1.2米(不含)以下儿童，多带1.2米(不含)以下儿童需购票，免费"
华夏文旅西安度假区,咸阳,西安市浐灞生态区华文路1518号,,029-86729999,介绍->开放时间->优待政策->服务设施,"华夏文旅西安度假区项目包括西安华夏文旅大剧院、西安华夏文旅海洋公园、西安华夏文旅水世界及餐饮商业等配套设施。华夏文旅大剧院全天候上演会跑的实景演艺《驼铃传奇》秀，首创旋转行走式观众席，将现代高新科技与驼道丝路的传奇历史文化经典相融合，给观众带来超凡的视觉体验和心灵震撼，以正能量传播西安最辉煌历史时期的文化传奇。
《驼铃传奇》秀
西安华夏文旅大剧院作为华夏文旅西安度假区项目的标志性建筑，设计为一座长142米，宽128米，高约50米的大型椭球体建筑物，可容纳3000人同时观看演出。剧场中央巧妙设计并修建一座可移动观众席，打破了世界单一舞台演出模式，通过旋转行走看台将观众送至最佳观演位置，带给观众全新的视听享受。会跑的实景演艺《驼铃传奇》秀，由华夏文旅集团董事长夏春亭担任总策划、总导演、总编剧。在编撰《驼铃传奇》秀的过程中，以“一带一路”为主线，深入挖掘大唐传统文化，追寻驼队丝绸之路上的踪迹，以正能量传播西安最辉煌历史时期的文化传奇。整场演艺分为序幕《岁月再现》及《送君千里》、《狼道遇险》、《异国风情》、《祥雨洗尘》、《迎郎归来》、《华夏盛世》七幕剧情，以“好看、好听、好玩”为宗旨，打造出一部面向大众、雅俗共赏、喜闻乐见、大快人心的演艺。演出情节设计以一对新婚燕尔的夫妻《送君千里》依依惜别开场，讲述西行驼队一路经历火山、雪崩、风沙、大漠等自然险阻以及狼群突袭，九死一生；随后满载货物返程，途中祈福巴米扬，巧遇天降圣水，在亲人的期盼中安然回到长安，期间也穿插描述异域风土人情；整场演出跌宕起伏，为观众带来震撼、刺激、唯美、欢快的视听感受，使用发明专利多达47项，骆驼、苍狼在其中也有惊险刺激的表演。《驼铃传奇》秀带你穿越大漠风沙的豪迈与苍茫，倾听丝绸之路上悠远驼铃的清脆与神秘，品味异域风情，见证荣耀大唐，聆听华夏千年回响。->全年 全天开放；华夏文旅海洋公园 2023年1月28日-2023年2月3日营业时间：10:00-18:00；停止售票：17:00；停止检票：17:30；->儿童：【华夏文旅海洋公园】每位成年人可免费携带1名1.2米(含)以下儿童入园，超出儿童按60元/人收费。，免费；身高1.2(不含)—1.4(含)，【华夏文旅海洋公园半价优惠】，半价
学生：全日制在校大学生凭本人真实有效学生证件【华夏文旅海洋公园半价优惠】，半价
老人：老人 65周岁（含）以上老人凭借本人身份证、老年证等有效证件，【华夏文旅海洋公园半价优惠】，半价
军人：现役军人、军残凭借有效证件【华夏文旅海洋公园半价优惠】，半价
残疾人：凭借有效证件【华夏文旅海洋公园半价优惠】，半价
补充说明：以上为景区内华夏文旅水世界、《驼铃传奇》秀、华夏文旅海洋公园，的优待政策，仅供参考。->行李寄存：参考价格：免费
童车租赁：参考价格：免费；地址：客服中心"
小雁塔(荐福寺),咸阳,西安市碑林区友谊西路72号,今日09:00开放（17:00停止入园）,029-87803591,介绍->开放时间->服务设施,"小雁塔位于荐福寺内，因为塔形似大雁塔并且小于大雁塔，而得名。与大雁塔的喧嚣相比，小雁塔安静了许多。小雁塔下，露天摆放着不少历代精美的石佛、石狮、石马、拴马桩等石雕，喜欢民俗文物的游客不能错过。
小雁塔建于唐景龙年间（公元707年），是为了安置印度取经归来的“高僧义净”翻译佛经而建。初建时为十五层， 后因遭遇多次地震，现在仅存十三层。塔的内部有木梯，盘旋而上可达塔顶。
荐福寺创建于唐睿宗文明元年（公元684年），原址位于唐长安城开化坊，后被毁，在如今的地址重建。寺内保存有公元1192年（金明昌三年）铸造的大铁钟。在清代，每天清晨这里会敲钟，这就是著名的“雁塔晨钟”。如今每年的元旦，这里会举办敲钟祈福的活动。
2007年，在荐福寺内又修建了西安博物院，增加了湖面以及新的园林绿化景观。->全年 周二；2023年11月1日-次年2023年3月14日 ,- 09:00-17:30,（16:30停止入园）；2023年3月15日-2023年10月31日 ,- 09:00-18:00,（17:00停止入园）；春节,劳动节 09:00-18:00开放；每周二逢国家法定节假日正常开放->停车场：【小雁塔景区北门停车场】参考价格：大巴9元/小时；中巴6元/小时；小车3元/小时；地址：西安市雁塔区友谊西路；库位：90；【小雁塔景区西门停车场】参考价格：大巴9元/小时；中巴6元.小时；小车3元/小时；地址：西安市朱雀大街北段；库位：88
WIFI：账号：xytyk；密码：bwyyk123；范围：全景区
手机充电：游服中心可有自助手机充电宝租赁
行李寄存：参考价格：免费
景区讲解：10人以下语音讲解费用100元/次，外语讲解150元/次；11人~20人团队200元/次；免费讲解：周一~周五（除周二闭馆）每天10:30、15:00免费讲解；时长：90分钟
景区地图：小雁塔景区西门及北门入口处有景区导览地图
讲解器租赁：参考价格：押金200元，归还设备需扣除租金30元/次后退回，耳机需另付10元/副
童车租赁：参考价格：需身份证及200元押金免费租赁；地址：游客中心
雨具租赁：参考价格：免费，需押金100元；地址：游客中心
轮椅租赁：参考价格：需身份证及300元押金免费租赁；地址：游客服务中心
卫生间：景区内含有卫生间；北门安检入口处；大雄宝殿西侧；西安博物院展馆内
母婴室：地址：景区内含有母婴卫生间
残障通道：景区含有残障通道
纪念品商店：含有两个纪念品文创商店；藏经楼南侧及西安博物院展馆内
自动售卖机：景区内含有多个自助售卖机
便利店：景区内含有两个商店；位置：东长廊及方丈殿(长安古乐演出）门口"
钟鼓楼广场,咸阳,西安市莲湖区北院门街道西大街1号,,,介绍->开放时间,西安钟鼓楼广场又叫尚书省广场，位于东西南北四条大街的交汇处，面积达6万平方米，仅次于北京的天安门广场。广场东侧为有着600多年历史的钟楼，西侧为全国大的鼓楼。20世纪90年代末，钟鼓楼广场建成后，钟楼和鼓楼得以相视而望。据考证，这里曾是盛唐时期尚书省所在地，为当时执行国家政务的高行政机关。如今建成的钟鼓楼广场绿草如茵，草坪用石板隔成了九经九纬，就是唐长安街坊棋盘式的结构。广场北侧，建有“同盛祥”、“德发长”、“王海棠”等久负盛名的老店铺；而广场下面则是世纪金花购物中心。另外钟鼓楼广场上还建有音乐喷泉，夜幕降临，广场、钟楼、鼓楼的灯光都亮起的时候非常漂亮。即使不登钟、鼓楼，在广场上欣赏一下这唯美的夜景，也会有不一样的感受，许多漂亮的摄影照片都是在这里拍出的。->全年 全天开放
大慈恩寺,咸阳,雁塔南路,今日08:30开放（17:00停止售票，17:00停止入园）,13379218670,介绍->开放时间->优待政策,"大慈恩寺，位于唐长安城晋昌坊（今陕西省西安市南），中国“佛教八宗”之一“唯识宗”（又称法相宗、俱舍宗、慈恩宗）祖庭，唐长安三大译场之一，已有1350余年历史。
大慈恩寺是唐长安城内知名、宏丽的佛寺，为李唐皇室敕令修建。唐太宗贞观二十二年（648年），太子李治为了追念母亲文德皇后长孙氏创建慈恩寺。玄奘在这里主持寺务，领管佛经译场，创立了汉传佛教八大宗派之一的唯识宗，成为唯识宗祖庭。大慈恩寺内的大雁塔又是玄奘亲自督造，所以大慈恩寺在中国佛教史上具有十分突出的地位，一直受到国内外佛教界的重视。
1961年3月4日，大慈恩寺大雁塔被国务院公布为全国重点文物保护单位。
2001年初，大慈恩寺被评为首批全国4A级旅游景区。
2014年06月22日，在卡塔尔多哈召开的联合国教科文组织第38届世界遗产委员会会议上，大慈恩寺内的大雁塔作为中国、哈萨克斯坦和吉尔吉斯斯坦三国联合申遗的“丝绸之路：长安-天山廊道的路网”中的一处遗址点成功列入《世界遗产名录》。
2016年5月14日，世界上现存少有的一株玄奘手植的娑罗树子树，经多年培育，成功移植到西安大慈恩寺。
大雁塔位于大慈恩寺内，是唐高宗永徽三年（652年），玄奘法师为供养从印度请回的经像、舍利，奏请高宗允许而修建。塔高64.5米，共七层，塔底呈方锥形，底层每边长25米，塔内装有楼梯，供游人登临，可俯视西安全貌。
塔上有精美的线刻佛像，有知名的《大唐三藏圣教序》、《大唐三藏圣教序记》碑，有中国名塔照片展览、佛舍利子、佛脚石刻、唐僧取经足迹石刻等。现今大雁塔经过修复，古塔雄伟，寺殿香火缭绕，庭院鲜花争艳，是一处特别吸引国内外游人的游览胜地。钟、鼓：是寺院的号令，俗有""晨钟暮鼓""之说。东侧钟楼内悬吊明代铁钟一口，嘉靖二十七年十月（1548年）铸造，重三万斤，高三米多。唐代学子，考中进士后到慈恩塔下题名，谓之""雁塔题名""，后沿袭成习。->全年 08:30-18:00,（17:00停止售票，17:00停止入园）->学生：6周岁（不含6周岁）至18周岁（含18周岁）的未成年人、全日制大学本科及以下学历学生（不包含研究生、成人院校、在职教育、网络教育）凭有效证件实行半票。 香港、澳门、台湾等入境游青少年凭《港澳居民来往内地通行证》、《台湾居民来往大陆通行证》或学生证件等有效身份证明，享受与内地青少年同等的优惠政策。，半价
老人：65周岁（含）以上老人，免费
儿童：6周岁（含）以下或身高1.2米（含）以下儿童，免费
军人：现役军人（含军队离退休干部）、国家综合性消防救援人员、退役军人凭军官证（离退休证）、士官证、消防人员证、退役军人优待证，免费
残疾人：残疾人凭相关证件，免费"
陕西考古博物馆,咸阳,西安市长安区文苑南路与终南大道交汇处东北侧,今日09:00开放（16:20停止入园）,029-89251666,介绍->开放时间,"陕西考古博物馆常设展览以“考古圣地华章陕西”为主题，分为“考古历程”“文化谱系”“考古发现”“文保科技”四个篇章。->全年 -,- 09:00-17:00,（16:20停止入园） 周三；中国法定节假日 09:00-17:00开放（16:20停止入园）"
陕西自然博物馆,咸阳,西安市雁塔区长安南路88号,,"029-85331256,029-85331352",介绍->开放时间->优待政策->服务设施,"陕西自然博物馆于2008年1月5日正式开馆，占地103.79亩，建筑面积16107平方米，其中展示面积10700平方米。目前为西北地区大规模的集教育、收藏、研究、展示于一体的综合类自然博物馆，先后被授予全国科普教育基地、国家AAAA级旅游景区、国家二级博物馆、陕西省生态文明教育基地等称号。
展馆现设自然展馆、肯尼斯·贝林展馆、穹幕影院和5D动感影院。
（1）自然展馆：设有地质万象、古生物长廊、神奇秦岭、昆虫王国、生命之光展厅、珍惜世界动物展厅。陈列大熊猫、朱鹮等230余种珍稀动物标本；鱼龙、翼龙、马门溪龙、乌龟、蜻蜓等上亿年的古生物化石；还有珍贵的植物标本独叶草等。
（2）肯尼斯·贝林展馆：肯尼斯·贝林展馆位于陕西自然博物馆北侧的球体建筑内，展馆以“星球·自然·共生”为主题，以“与动物同行”为展示主线，以世界野生动物标本为基础，辅以沉浸式展示方法，分为多彩亚欧、野性非洲、雄浑美洲、奇异北极、神秘澳洲、生存法则、江海律动、穹幕影院、勇敢者通道、互动体验等10个展示体验区，共展出七百余件世界珍稀野生动物标本。
（3）穹幕影院：是目前我国西北地区最早、规模大的数字穹幕影院，半球形的银幕直径18米，利用8部激光投影仪进行画面融合,形成浑然一体的全景画面，使观众身临其境。
（4）5D动感影院：内设12个座位，影院融视觉、听觉和动感于一体，观众完全融入立体场景之中，感受其中的震撼和新奇之旅。
通过近37亿年的标本与历史对话，叙述人与自然的故事，为西安这座国际化大都市增添了不可缺少的品位和厚重的文化底蕴。->2023年1月1日-2023年2月5日 09:00-17:00,；2023年7月1日-2023年8月31日 09:00-17:00,；2023年2月6日-2023年6月30日 周三-周日 09:00-17:00, 周一-周二；2023年9月1日-2023年12月31日 周三-周日 09:00-17:00, 周一-周二；中国法定节假日 09:00-17:00开放->儿童：儿童1.3米(含)以下或6周岁(含)以下凭本人身份证等有效证件，在成人陪同下可免费参观；一成人仅限携带两名免票儿童进馆参观，免费；儿童1.3米—1.5米（含）可享受半价优惠，半价
学生：全日制在校 大、中、小学学生（不含成人教育、研究生）凭学生证，享受半价优惠，半价
老人：老年人持敬老证或 65周岁（含）以上持本人有效证件免票，免费
军人：本人持军人保障卡免票。本人持残联有效证件或军残证免票，免费
消防救援人员：消防救援人员持有效证件（干部证、消防证、学员证）免票，免费
补充说明：注：优待政策仅限肯尼斯·贝林展馆及自然展馆。所有影院均无优惠（穹幕影院、5D影院门票不实行优免政策，执行一人一票制，穹幕影院门票不单售）->停车场：【陕西自然博物馆室外停车场】参考价格：5元/小时；地址：陕西自然博物馆东西两侧；库位：80
行李寄存：
景区讲解：景区中文讲解：通讲150元（含双馆2小时），单馆80元（1小时），须提前预约
景区地图：博物馆大厅有展览图及景点介绍
讲解器租赁：参考价格：免费，需抵押身份证及100元押金
童车租赁：地址：游客中心
雨具租赁：地址：游客中心
轮椅租赁：地址：游客服务中心
卫生间：景区内外，广场均含有卫生间"
西安欢乐谷,咸阳,世纪大道1号,,,介绍->开放时间,陕西欢乐谷，坐落于陕西省西安环山旅游路户县石井镇，项目计划总投资1.2亿元，总占地面积800余亩，共分三期工程完成，一期投资已完成1500余万元，其中宾馆部有别墅式标准客房100余套，休闲区面积50余亩，会议餐饮建筑1200余平方米，住宿餐饮部可一次接待300余人的会议和聚会活动，休闲区可一次接待近万人游览。->全年 全天开放
西安欢乐谷·玛雅海滩,咸阳,陕西省西安市长安区沣泾大道西侧,今日10:30开放,029-89501777,介绍->开放时间->优待政策,"西安欢乐谷目前已开放西安欢乐谷·玛雅海滩区域
西安欢乐谷·玛雅海滩是一座全智能化水公园，全园智慧化购物、线上预约排队、智慧储物等功能一应俱全；第三更衣室，关爱每个家人的需要。
玛雅海滩拥有家庭游玩戏水项目，让一家人都玩得嗨；园区设计上充分考虑西安气候特点和地域特色，提供覆盖超大面积遮阳雾森系统，让游客在亲水、戏水、游水、乐水中体验舒适贴心的乐园水互动。->2023年6月1日-2023年8月31日 10:30-20:30,；具体营业状态以当天开放情况为准->儿童：1.2米(含1.2)以下的儿童(需具有安全监护能力的购票成人陪同入园，每名购票成人限带一名1.2米及以下儿童)，免费"
青龙寺,咸阳,西安市雁塔区西影路铁炉庙村北1号(乐游原景区),,"029-85531096,029-85521498",介绍->开放时间,"青龙寺，寺初创于隋开皇二年（公元582年），当时称灵感寺，是佛教密宗寺院，著名的“入唐八大家”中的六家（均为入唐的日本僧侣），都受法于此。这里是日本人心目中的圣寺，是日本佛教真言宗的祖庭。
1986年，青龙寺从日本引进千余株樱花树植于寺院，每年3-5月间，樱花盛开。此外，寺内还有牡丹、芍药、郁金香等花卉展出，是当地婚纱外景拍摄地之一。->全年 周二-周日 08:30-18:00,（17:00停止入园） 周一"
